c2500120,s8,"We ordered room service and the in-room dining staff member who came to set things up was very helpful, courteous and…"
c2500121,s1,Macau is an experience that perhaps is love or hate
c2500121,s2,Dubbed the Asian Las Vegas we found that the Cotai Sands strip was devoted to serious gambling
c2500121,s3,The Venetian is a very different experience to Western hotels but amazing in its grandiosity - this place is seriously big
c2500121,s4,"In fact we got lost a number of times! Our room was very luxurious (beds and pillows were really comfortable), large bathroom, big bath and separate toilet"
c2500121,s5,"Our daughter enjoyed room service and a movie on one of the two large screen tvs one night, but there are quite a few dining options"
c2500121,s6,We went to the casino and were lucky enough to come out ahead
c2500121,s7,"The gambling is serious business and word of warning, it is definitely not dressy"
c2500121,s8,"The shopping is pretty good and the canals and ""Venice"" style shopping mall is…"
c2500122,s1,Good location and lovely large room
c2500122,s2,All the amenities you could want
c2500122,s3,"But the check in queue was one of the longest I have ever experienced, and it's so tedious to have to walk through the casino every time to get back to the hotel"
c2500123,s1,We stayed here as we were attending an event in the hotel
c2500123,s2,"The room was big, comfortable and well furnished"
c2500123,s3,However the toilet blocked and we had to call for it to be repaired
c2500123,s4,At one point there was no hot water
c2500123,s5,The repair guy took a long time to fix the toilet
c2500123,s6,The check in staff were polite but slow and seemed overworked
c2500123,s7,"Given the increasing choice of hotels in Macau, I would choose to stay elsewhere"
c2500123,s8,The Venetian is overpriced
c2500124,s1,Nice hotel with spacious room and huge bathroom
c2500124,s2,Great facilities - great pool & gym
c2500124,s3,However encountered not very pleasant experience when using the lift
c2500124,s4,"imagine with 6 lifts, its take us almost 25mins to get down or long queue to get up"
c2500125,s1,Recently spent 2 nights at this hotel
c2500125,s2,It needs to be seen to be believed
c2500125,s3,When you enter the lobby you get an idea of how massive this place is
c2500125,s4,"But unfortunately that also means lots, and lots of people (but hey it is China)"
c2500125,s5,We queued for 45 minutes to check in and were then told our room wasn't ready
c2500125,s6,It was sorted quickly though and the room was worth the wait
c2500125,s7,"The rooms are huge by hotel room standards, so is the bathroom"
c2500125,s8,Very clean and reasonably maintained
c2500125,s9,"The shopping within the Hotel/Casino complex is fantastic, with everything from designer to chain stores"
c2500125,s10,"There are a couple of restaurants within the complex, and also a food court that is open most of the night if you get the late night munchies"
c2500126,s1,I went with my clients and book into total room of 3
c2500126,s2,"No doubt this is one huge hotel in Macau, room size no question ask big and comfort"
c2500126,s3,But it is getting a bit old fashion because there are so hotel new and nice hotel build up in Macau almost every 6 months
c2500126,s4,"The in room TV is still CRT and no flat LCD, but all that is not really a problem as we only stay for one night"
c2500126,s5,"The next morning breakfast is the biggest issue, the breakfast provided by hotel is located quite far to almost all hotel tower"
c2500126,s6,"The food is horrible, I would say total fit for most mainland Chinese style and not for foreigner"
c2500126,s7,"The cost is very seasonable in Macau, but if you look for slightly cheaper with huge size and little bit luxury, Venetian is still a choice"
c2500126,s8,But don’t ask the package with…
c2500127,s1,"Room is very big if you come with 4 peoples, it is perfect"
c2500127,s2,But feel the room is old decor by the old tv and carpet is thin already
c2500127,s3,The hotel rate is high now compare to many new hotels around there
c2500127,s4,You can have many choices
c2500127,s5,"Overall is still good, since they provide you many shuttle buses, you can go many places in Macau"
c2500128,s1,"We were there, my cousin and me to try our luck at the in-house casino"
c2500128,s2,The hotel is clean with many boutiques covering all the luxury goods you can imagine
c2500128,s3,There are also a few places to eat if you need a break from the cards and dices
c2500129,s1,Expected so much from this hotel from what I heard and read but it was a little disappointing when we got there
c2500129,s2,We entered through the shuttle bus parking entrance and it was super crowded and noisy with tourists from the mainland
c2500129,s3,"The comfort room in that area is a bit dirty and who can blame the cleaning lady, she might not be able to keep up with all the people coming and going"
c2500129,s4,"The shopping area was nice and I enjoyed the free entertainment, like the stilt walkers"
c2500129,s5,"The food court, dined once and didn't like the food at all"
c2500129,s6,The casino was also nice
c2500129,s7,"Overall,  would've enjoyed the place if it wasn't that crowded"
c2500130,s1,I stayed at the Venetian Macau from 18 till 20th April at their Bella Suite - anticipating enough room for my kid and both of us as a couple
c2500130,s2,Venetian is a huge property with various attractions
c2500130,s3,"We were perched at the 35th Floor, with a good view of The Galaxy Resort and flowing river in view"
c2500130,s4,The Furniture and Washrooms are bit old-style with obstructive large doors (it blocks your way as you enter the room)
c2500130,s5,Food is average and complimentary breakfast was a big joke
c2500130,s6,Once there was no ketchup and nobody was able to tell how long will it take to get that on the table/ counters
c2500130,s7,The Refills at the buffet were late and poorly done
c2500130,s8,Golden Peacock Restaurant is a must-visit as this is a Michelin-starred and lives upto its reputation
c2500131,s1,Beautiful recreation of venice within such an enclosed space
c2500131,s2,Simply beautiful architecture Love the casino and the ample shopping available within
c2500131,s3,Its like a whole city within a hotel
c2500131,s4,But thats where all the problems start
c2500131,s5,1st - the rooms are so far out
c2500131,s6,Beware of venturing within the hotel
c2500131,s7,It may take you years to reach your hotel room and you will probably end up sleeping in the common lounge or lobby areas (although one can never figure out which one is which)
c2500131,s8,2nd - you ll have to circle the entire hotel if you dont have ur id with u at all times
c2500131,s9,Since crossing the casino floor is the fastest way to reach far away points in the hotel and you cant enter the casino without an id
c2500131,s10,(Which is only fair from the security perspective)
c2500131,s11,But worse is that if you have…
c2500132,s1,When u stay at the Venetian you've got everything you need !! The food & the entire shopping mall!!! The room is spacious & the amenities were nice! You need to show your key in order for you to be able to approach the guest lift
c2500132,s2,The security should smile more though !
c2500133,s1,The most popular and one of the oldest hotels of Macao
c2500133,s2,Beautiful rooms but the bathroom had some broken shower fittings
c2500133,s3,Difficult to get adjoining rooms in case you travelling in group
c2500133,s4,We almost had to walk for 5-7 mins between the two rooms
c2500133,s5,Being a tourist attraction the hotel is over crowded and hence not much of privacy that one can expect
c2500133,s6,Only 1 restaurant in the entire resort that serves vegetarian food
c2500133,s7,The entire resort is so big that one can easily get lost in the property and definitely be prepared to walk walk n just walk for miles
c2500134,s1,If your vegetarian / vegan / Jain don't opt for breakfast/lunch/dinner in your booking
c2500134,s2,Golden peacock restaurant is great Indian cuisine
c2500134,s3,Staying is advisable only is you are here for gambling
c2500134,s4,otherwise staying at Macau Peninsula ( Wynn ) is preferred
c2500134,s5,the whole cotai strip can be explored in a day
c2500134,s6,most macau cultural things are located at the Peninsula
c2500134,s7,"Taipa is only great for its casinos (except Coloane and taipa village)  Otherwise rooms and hotel (property) is great in terms of its scale and its shopping offerings  Also, due to its popularity the hotel is always too crowded and at times its disturbing when one is on a leisure trip"
c2500135,s1,"Huge place, great casino (though hardly any low stakes tables)"
c2500135,s2,I guess it requires some maintenance since i had visited this place 8 years back as well when it really looked new
c2500135,s3,Not anymore
c2500135,s4,Check in / Check Out a huge issue though the staff is trying their best to make it quick and comfortable
c2500135,s5,Rooms are all suites and good
c2500135,s6,"However, no service whatsoever in the rooms (they claimed that they would charge 450$ just to come and empty my minibar!) All in all the rating is only for the property though it may be better to stay in another hotel which offers some services and maybe spent the day here"
c2500136,s1,This place is simply enormous - the rooms are huge which is great if you need to entertain 10 people (and with two TVs for some reason) but for me it was a bit over the top for a hotel of this standard
c2500136,s2,"To get from one side of the hotel to the other takes a long time, and it is very easy to get lost"
c2500136,s3,"The casino is massive as well, again not really my taste but if you're into that kind of thing you will enjoy it"
c2500136,s4,"The room service and mini bar were extremely expensive, and generally the decor rather erred on the side of tacky"
c2500136,s5,"The indoor gondola is a fun feature, but it is a bit like Las Vegas meets Disney"
c2500136,s6,"Overall if you want somewhere that isnt horribly expensive (by room rate) and has its own casino then it works, but I would look for something a bit smaller with more…"
c2500137,s1,"Depending on what you want out of our holiday, you will either love the Venetian or hate it"
c2500137,s2,It is a very high end hotel and it shows in the decor and scale of everything here
c2500137,s3,The rooms we got were relatively cheap for the type of hotel and the room we got (we paid approx 160USD for a nice fancy large room)
c2500137,s4,The problem is that this is the hotels business model
c2500137,s5,"give out rooms for cheap and get people into their shops/eateries and casinos, and make money off them there"
c2500137,s6,It's the typical Vegas business model and that's fine but it may not be the experience you're looking for
c2500137,s7,The hotel is insanely crowded
c2500137,s8,The check-in area was like a train station and it took us almost an hour to check in
c2500137,s9,The common areas of the hotel are mostly all open to the public and you will…
c2500138,s1,My review of this place is written from my own perspective and it is nothing to do with the resort by itself
c2500138,s2,One of my friend suggested this place and we booked one of the suites for a night stay
c2500138,s3,Pick up from Macau ferry point was very smooth
c2500138,s4,There is a lift one should take to go down to board the bus with your luggage
c2500138,s5,Arrival to the hotel was a big disappointment as we were dropped along with so many tourists from other hotels who come to visit this resort and we were lost
c2500138,s6,There was none to guide us from the bus drop area
c2500138,s7,"One guy came and gave us the luggage tags, Thats it"
c2500138,s8,"So we managed to go inside, pushing aside visitors and saw a line and joined them"
c2500138,s9,Later we realised it is for left luggage
c2500138,s10,Then we were directed to the reception which was quite far
c2500138,s11,Pleasant…
c2500139,s1,If i can remember you can go to the west lobby to hop on th free shuttle bus
c2500139,s2,"the line is so long, make sure to spare about 10-15 minute"
c2500139,s3,You can also store your luggage in the lobby hotel and have to pay 10 MCU for 24hours service (they will ask for your passport)
c2500140,s1,The Resort is a city within a city and is an Exact Replica of Venice and a Bigger Replica of Las Vegas
c2500140,s2,The Rooms are spacious and the hotel lobby is big (In fact they have 2)
c2500140,s3,The only downside is there are just too many people and very difficult to get attention from the staff at the resort
c2500140,s4,Not recommended for people who wants a quiet and luxurious time
c2500141,s1,"The rooms look nice and welcoming, but there was a lot of dust on the furniture"
c2500141,s2,"It's a convenient place to stay with lots of shops and a variety of food at the food court and it's near the Old Taipa Village, which is quite nice to walk around"
c2500141,s3,It is also located near to the other big hotels if you fancy window shopping or trying out different cuisine
c2500142,s1,"I hate to say this, but while it is very good by Macau standards, it is a pale imitation compared to the one in Vegas"
c2500142,s2,The vibe just feels wrong
c2500142,s3,somehow it ends up being tacky and kitschy when done here
c2500142,s4,"The other downside is that once you step out of the hotel, you're facing a hot empty dusty road that leads to nowhere"
c2500142,s5,Which is most definitely not the Strip
c2500142,s6,"Can't blame the hotel, but if you're looking to recreate the Vegas experience, this is most certainly not it"
c2500143,s1,We booked a two day stay in the Rialto Suite hoping for something special
c2500143,s2,They would do well to have a buggy to deliver you to the room as it is a LONG walk from reception
c2500143,s3,The amount of smoke in the hallways was a major put off before we even reached our room
c2500143,s4,"The suite was huge and in its day would have been wonderful, however the hotel badly needs a freshen up"
c2500143,s5,"The in room dining was great, beautifully setup and in good time"
c2500143,s6,The shopping was a real disappointment
c2500143,s7,"Even thought the labels were of a high rep, the sizing was definitely not on par with other major boutiques worldwide"
c2500143,s8,"We booked a room with views over the water, what we actually got was a very ugly aspect overlooking air conditioning units and industrial looking buildings"
c2500143,s9,"If you decide to visit, be prepared…"
c2500144,s1,"Stayed during the lunar new year period, overall a pleasant stay, however hotel is slightly  old but the rooms are huge and good shopping area"
c2500144,s2,Wifi is slow great walking distance to other shopping area
c2500145,s1,"its my 2nd stay at the hotel, the first one is 7 years ago, stayed here again last january when we went to macau and quite dissapointed with the hotel, the room is quite worn out,the furniture is shabby and need some of them need replacement, though we cannot complain about the cleanliness and service in the room, its marvelous! went to the shoppes at venetian and quite dissapointed its not as grand, there's no more carnival or entertainment, some of the shoppes is not well known, i prefer to shop at fourseason or sand's cotai"
c2500145,s2,"i think venetian macau already loose its charm to newer hotel and resort at macau, there's so many newer and more luxurious hotel in macau to choose"
c2500146,s1,Very luxurious big rooms
c2500146,s2,Fully self sufficient resort
c2500146,s3,Nice place to spend a couple of days even if you are not into gambling
c2500146,s4,Would have loved a better collection of pubs/bars
c2500146,s5,"Also, better guidance on navigating through the well spread out place"
c2500146,s6,"Personally, for me the total artificial light mall like atmosphere does depress me after some time"
c2500146,s7,But anyways if you are not using the casino in the basement - there is no point staying here for more than a couple of nights
c2500146,s8,The artificial Venice like shopping facade has good novelty value though some might find it a bit tacky
c2500146,s9,If Macau is your thing
c2500146,s10,Stay here !
c2500147,s1,Went here for a work trip and wouldnt ever pay to go there myself
c2500147,s2,"The hotel is massive and everything is fake, fake marble, fake decoration"
c2500147,s3,Its so big I got lost many times and no one speaks english so directions are useless
c2500147,s4,Food is very average and I was disappointed
c2500147,s5,Rooms are good very large and comfortable
c2500147,s6,Beds are comfortable and bathroom is large
c2500147,s7,"Not really anything on the TV as only 1 english speaking channel which was the ABC  Shopping was good, but expensive and again people dont really speak english so it was challenging"
c2500147,s8,There was only 1 coffee place Starbucks and line was out the door most times of the day
c2500147,s9,Taxi drivers speak no english to communicating where you want to go is also hard
c2500147,s10,Gambling area is huge and was always packed
c2500147,s11,There isnt really any…
c2500148,s1,Had to stay here for a business conference
c2500148,s2,"This is a huge sprawling complex with a casino and hundreds of shops, in addition to thousands of hotel rooms  The hotel is old and the age shows"
c2500148,s3,"Design is Venetian yes, but gaudy"
c2500148,s4,The room is huge and split level
c2500148,s5,"That's nice, but still old"
c2500148,s6,"The 2 TVs are still the obsolete cathode ray tube chunky boxes, which we've never seen in 10 years anywhere"
c2500148,s7,"The shower stall is what I prefer over the bathtub, but the brass shower head is rusty and noisy over 20-30 years' of use  The gym is average size and ok  The restaurants here are pretty average"
c2500148,s8,"The good and michelin restaurants in Macau are elsewhere   Conference facilities are ok, and the congress food ranges from average to poor  Shopping is ok and quite wide ranking from low to…"
c2500149,s1,This is a very large property that shows it's age
c2500149,s2,Rooms are quite large and the setup is very similar to the Venetian Las Vegas with beds on an upper level and a sitting room on a lower level
c2500149,s3,The furniture is on the older side and the hardware designs are also quite dated
c2500149,s4,"Large amours, projector TVs, and old plumbing hardware"
c2500149,s5,The beds were also terribly uncomfortable
c2500149,s6,hard mattress with very flat pillows
c2500149,s7,You really can't compare the Venetian Macau to the Venetian Las Vegas where things are just bigger and badder
c2500149,s8,"Overall, expect check-in and check-out to be similar to large properties"
c2500149,s9,Longer lines and more people
c2500149,s10,All the staff was very friendly and knowledgeable
c2500149,s11,"Most were able to speak Cantonese, Mandarin and English fairly well, although it is clear that…"
c2500150,s1,There are many lobbies and check in counters
c2500150,s2,We checked in at the main lobby
c2500150,s3,There were many people checking in
c2500150,s4,The staff were flat out but still many check ins
c2500150,s5,waited over 10 minutes in a line
c2500150,s6,We had made a reservation in one of the suites
c2500150,s7,After check in we were given the directions to go and we had to cart our own bags through the casino
c2500150,s8,The property is very big
c2500150,s9,Our suite was very big and very comfortable
c2500150,s10,Amenities were average
c2500150,s11,HK was good
c2500150,s12,The casino was very good
c2500150,s13,Security was a bit rude I thought with taking in their own language in front of the guests
c2500150,s14,We ate at the Deco restaurant
c2500150,s15,Average food and service
c2500150,s16,The peacock restaurant food was excellent and service very warm and efficient
c2500150,s17,Shopping is expensive
c2500150,s18,All the other facilities were ok
c2500150,s19,Check out was…
c2500151,s1,"Having gone to the Venetian twice a year since it opened, I'm very underwhelmed by the experience now"
c2500151,s2,"The checkin and walk to the room is fantastic, the rooms are spacious but because of the decor can be dusty, but look dated with the large old fashion tv and furniture"
c2500151,s3,"The staff beyond the reception can be lousy, with varying levels of service, some good and some bad"
c2500151,s4,"Had the worst breakfast experience of my life at McSorleys, it was just disgusting"
c2500151,s5,Yet had a fantastic dinner at Mortons and the staff in the Japanese restaurant are just down right rude
c2500151,s6,I still highly rate the Bellini lounge the live music is excellent and service is fantastic
c2500151,s7,"The elevators to the rooms are frequented by commercial ladies in the evening, but why are they allowed to do that when you…"
c2500152,s1,I could see why people would like it
c2500152,s2,Minimum bids on casino were pretty high so I couldn't bear to join in
c2500152,s3,More for experienced gamblers
c2500152,s4,"The grand receptions are all quite pretty and extravagant and the little Venice was a novelty but it was all a bit theme parky fakey cakey for me, but I wouldn't put anyone off going, if you like shopping and gambling then it's probably fab"
c2500153,s1,We were last here about 3 years ago and the resort is still of a high standard
c2500153,s2,but it has become extremely crowded throughout the Shoppes to the extent of being unpleasant
c2500153,s3,"Part casino and part shopping mall maze on the perimeter where the canals are, though much reduced congestion on the inner shopping area"
c2500153,s4,Definitely worth a visit
c2500154,s1,I did not stay at this hotel but visited the restaurants and other attractions within it
c2500154,s2,Painstaking effort to replicate the Venetian settings I must say
c2500154,s3,The false ceiling mimics the sky and is lit accordingly
c2500154,s4,"This means means it's always ""day"" inside"
c2500154,s5,It can get to you after a while
c2500154,s6,It’s a sprawling campus so the space inside is ample
c2500154,s7,There are all kinds of shops and attractions
c2500154,s8,Including the casino
c2500154,s9,The casinos I must admit are the most disappointing in Macau
c2500154,s10,It’s a farm of tables and slot machines
c2500154,s11,No drama anywhere
c2500154,s12,It reminded me of an open office with a zillion cubicles
c2500154,s13,I spent approximately 15 minutes looking around and made a quick exit
c2500154,s14,"Also everything was in Chinese, most has a minimum starting bet of 500$"
c2500154,s15,Didn't feel like throwing money away at stuff I…
c2500155,s1,The room was grand and had all the amenities one requires
c2500155,s2,"they are the biggest Casino in the world and you can imagine that it was quite crowded, however overall I had a pretty decent experience"
c2500155,s3,Have no comments on the Casino
c2500156,s1,This casino is the mirror image of Venetian in Las Vegas
c2500156,s2,Similar settings with gondolas with singing gondoliers
c2500156,s3,Lots of shopping with high ends shops and varieties of restaurants
c2500156,s4,Did not see any buffet restaurants like the Las Vegas Venetian
c2500157,s1,Ended up staying here one night after losing a passport
c2500157,s2,It was late when we checked in but the staff were pleasant
c2500157,s3,The rooms were massive and there was free wifi in the room which was an added bonus -- too bad it didn't work in the public areas of the casino
c2500157,s4,The grounds are HUGE and the food court has a very wide selection to choose from at very affordable prices
c2500158,s1,Here my compliment about this hotel
c2500158,s2,"Everything is well build its huge and everything canbe purchase here but theres not much signboard to show u where for food where to shop, and since its too big we are getting lost here for the first time"
c2500158,s3,"checkin in is smooth but i can say its a old hotel with carpet and dumpy smell on my room, the whole hotel smells too much of perfume everytime i return to lobby, we stayed in bella suite its four person room but they only provide 3 towels"
c2500158,s4,"And one little bottle shower and shampoo, and more worst is 11am we heard some renovation on going nearby, its not worth for a stay for 1900+\- hkd pernight, casino is very huge, low security, they dont even c your passport while u entering, evelator and escalator is link everywhere and there are more…"
c2500159,s1,Every1 knows about this hotel
c2500159,s2,But number of things are missing when u talk abt this hotel
c2500159,s3,The most important thing is that u don't get the feeling of being important
c2500159,s4,I mean to say when u stay at a lux star hotel one should get that feeling
c2500159,s5,Evwrytime u will see a different staff
c2500159,s6,Different Security
c2500159,s7,Rest all gud with this hotel
c2500159,s8,its a complete city
c2500159,s9,U need not to go outside for any other thing
c2500160,s1,Fantastic room layout
c2500160,s2,Unfortuately not very well maintained
c2500160,s3,Room was dirty and smelt of cigarette smoke and ours was meant to have been a non smoking room
c2500160,s4,There are other hotels within the same complex we stayed in after that were a lot cheaper and a lot nicer
c2500160,s5,The pool area at Venetian was a huge disappointment
c2500160,s6,Personally I'd stay elsewhere after experiencing other hotels
c2500161,s1,"Everyone hyped about the Venetian, so I finally decided to stay here for the weekend during one of my business trips"
c2500161,s2,"Originally, by looking at the photos and feedback from my friends, I was expecting an amazing suite with everything a modern hotel would offer and more"
c2500161,s3,"However, upon check-in, I realised that this is a hotel that hasn't been renovated for 10 years"
c2500161,s4,"One of the TV was a CRT TV!  I haven't seen one of those in years; shouldn't they donate the CRT TV to the Macau Museum?  The wall paper, the carpet, the renovation were all so dated; it did not feel like a luxury hotel that it's positioned itself to be"
