c2500345,s6,Allmajor shopping brands have outlets inside this mini-town
c2500345,s7,"One level modelled on Venice with its market square ,winding canals, bridges & gondola rides is…"
c2500346,s1,"second time staying here, rooms are spacious, still an air of past luxury to it but very smokey"
c2500346,s2,room service is ok
c2500346,s3,the mall within this resort and the mall connecting from four seasons hotel next door is good
c2500346,s4,"its ever changing in Macau, many more other newer luxury resorts sprouting along this Strip"
c2500346,s5,"enjoyed the pools this time, although bit small and scattered, lots of kids, crowded with deck chairs and minimal food & beverage options by the poolside at the time we were there"
c2500346,s6,"location is right by the Strip (similar to the Las Vegas Strip layout), good if you are planning to do a resort crawl and shop at the malls located within these resorts"
c2500346,s7,close to the cotai ferry and local airport
c2500346,s8,"if you are interested in local sites, they are mainly located on the Macau Island"
c2500346,s9,you…
c2500347,s1,Have stayed here 3 times now and have found the room prices steadily rising to the point that I doubt we'll stay again given lack of offers available
c2500347,s2,"We paid about £250 for 1 night room only - which for the experience is great - but how long do you really stay in your room and get vfm?   Don't get me wrong - we managed to get one of the few family suites which had great touches such as: - mini towelling bath robes hung in the wardrobe - plate of chocolate cookies and strawberries - Wii - double sized bright orange bunk beds - bright orange bean bags - FABULOUS touches in the bathroom including a family of 4 rubber ducks, baby toiletries, pink and green children's toothbrushes and toothpaste"
c2500347,s3,"The face clothes by the sinks and bath had been shaped into an elephant, bird and dog…"
c2500348,s1,Just a short break at Venetian & Glaxy during the last holiday
c2500348,s2,Huge of Chinese around the world
c2500348,s3,"The service ok la as for few thousand of rooms, especially  the ambassdor in lobby"
c2500348,s4,"I perfer the mattress & pillow in Vemetian more comfortable than Glaxy, also the bathroom well equiped"
c2500348,s5,Only need to take care the Maintance job in details
c2500348,s6,other were good condition
c2500348,s7,The swimming pool take a long walk
c2500348,s8,"ok la for vacation,  However I like the beach / pool in Galaxy more fun"
c2500348,s9,"Anyway, well dome keep up"
c2500349,s1,The Venetian Macao is a huge all-suite hotel complex situated on the progressing Cotai strip of Macau
c2500349,s2,It is very similar to their property in Las Vegas
c2500349,s3,It comes complete with the indoor canals and airconditioned shopping plazas
c2500349,s4,"Like any other mega-casino hotel, they are not able to provide the personalized service or guest recognition that an individual can expect in a Four seasons or a Fairmont hotel"
c2500349,s5,"After a few years of operation, rooms are still in fairly good shape"
c2500349,s6,The rooms we booked were clean and in order
c2500349,s7,"It was generous in size, and a fax - copier machine is also at every workdesk"
c2500349,s8,"Everything needed is within arm's reach to dining, shopping and gambling choices"
c2500349,s9,The place is very popular with the locals so expect these areas to get crowded during the day
c2500349,s10,The…
c2500350,s1,First of all the food is disastrous
c2500350,s2,"We decided to check in an realised that we had to drag our suitcases on carpets,which is not easy despite the wheel, to a long distant without any help"
c2500350,s3,the check in was fast
c2500350,s4,The rooms were great
c2500350,s5,What was pathetic was that a hotel as big as Venetian would charge its guest money to use the internet
c2500350,s6,We had stayed at a 3 star property in HK before this and internet was complimentary so were shocked at this money making dirty scheme of theres
c2500350,s7,then while having a bath the shower just fell off
c2500350,s8,Fortunately someone came and repaired it fast
c2500350,s9,The checkout takes a long time
c2500350,s10,It takes the bellboy half hour to come and get the luggage
c2500350,s11,We decided to have asian
c2500350,s12,food for lunch where a chef helped us choose vegetarian food
c2500350,s13,First they had only 3…
c2500351,s1,The reviews about the Venetian being smoky and huge are correct
c2500351,s2,"I haven't been to the Vegas property, so this was my first time in a hotel like this"
c2500351,s3,"I visited very recently with my husband, my mum, her partner and my aunties"
c2500351,s4,"It is located about a 5-10minute complimentary bus ride, from the airport"
c2500351,s5,You could technically walk in between the two
c2500351,s6,The reception area is huge and they also have a great bag drop service in case you check in too early or check out early before a late flight
c2500351,s7,"The ceilings, though pretty, are wall paper-prints!  The casino is in the centre of the hotel and you need to walk through it in order to access any food, suites or shops"
c2500351,s8,The casino is like any other casino
c2500351,s9,There is a smoking side and a non smoking side but it doesnt make much of a…
c2500352,s1,I have just returned from a conference which was held at the Venetian in Macau
c2500352,s2,The hotel is modelled on the one in vegas and in many respect is very similar and in many respects quite different
c2500352,s3,These places are a mecca for gambling
c2500352,s4,"Whereas the property in Vegas has a much more fun atmosphere about it, the Macau property is much more business with Chinese gamblers"
c2500352,s5,"Its a huge property, somewhat gaudy but i expected nothing less"
c2500352,s6,Some off the walkways in the hotel are like dual carriage ways
c2500352,s7,The decor on the ceiling in somewhat OTT
c2500352,s8,The upside away from the casinos is that it does have great shopping and if you want to take trips on the gondola's
c2500352,s9,Not somewhere i would visit or spend money but as it was a conference it seemed OK
c2500352,s10,I think 3 days in Macau and 3 days at the…
c2500353,s1,Stayed 2 nights at the Venetian Macau with the family
c2500353,s2,The hotel is just massive with a shopping mall and connected to few other hotels
c2500353,s3,You will get lost
c2500353,s4,Was very impressed with the rooms as they were very large with a sitting area and the bathroom was very large and clean
c2500353,s5,The casino is in the centre of the hotel so if you are intending to gamble then it is very handy as you can enter the casino from any direction
c2500353,s6,A bit of a maze and struggle if you are under 21 as you will not be allowed to enter the area
c2500353,s7,"It took ages for us to find our room when we checked in as wherever we end up, it's the entrance to the casino"
c2500353,s8,There are many places to eat but the food was nothing special
c2500353,s9,We decided to go out of the resort and went for a local Portuguese restaurant which was…
c2500354,s1,"This hotel looks really luxury and spacious, all rooms are suites, with a living area, window bay, sofa, 2 tvs, etc"
c2500354,s2,The room I was staying had 2 double beds too
c2500354,s3,"The bathroom is huge too, with 2 basins, a bath tub and shower room, a dresser, and another door to toilet"
c2500354,s4,"There's one thing that I dont like, the room is full of the smell of cigarette although it's not a smoking room"
c2500354,s5,"Since both of my husband and I dont smoke, we dont feel comfortable in that room, but I suppose it's ok for smokers"
c2500354,s6,The casino is just right next to the hotel as in Las Vegas etc
c2500354,s7,So you got casino and many shops there all in one roof
c2500354,s8,"Moreover, they build a artificial canal, with Gondola that you can pay and ride, it's about 110 HK dollars, around 10 pounds per person,  the gondoliers might…"
c2500355,s1,We spent one night at the Venetian Macau as part of a longer stay in Hong Kong and to see a particular show in town
c2500355,s2,We arrived on the Cotai Ferry and took the Hotel shuttle to the resort
c2500355,s3,Check in was quick and efficient and we were given an upgrade to a Cotai view room
c2500355,s4,"When we got to the lift to go to our room we thought we would be away from the cigarette smoke that overpowers the casino, we were wrong! Even though we were on a non smoking floor, the lift, corridors and our room smelt"
c2500355,s5,"The room however was really luxurious, with a huge bathroom and sitting area"
c2500355,s6,Although it does look a bit worn and I think it's themed décor has aged quickly
c2500355,s7,We had fun wandering through all the shops and the themed facade's look great
c2500355,s8,There was a lady singing opera from a first floor…
c2500356,s1,Stayed here for a 2 day conference (with my wife accompanying me)
c2500356,s2,GOOD BITS The room was very spacious with a lounge area
c2500356,s3,The bed was comfortable
c2500356,s4,Room was clean
c2500356,s5,BAD BITS Personally I found the hotel complex was just too large and cumbersome
c2500356,s6,For example - from the check in reception desk we had to walk about 300 metres through the casino area and out the other side to get to the hotel lifts which was pretty odd
c2500356,s7,If you wanted your luggage delivered to your room it was going to take 30 minutes - so we ended up wheeling ours through the casino ! Not a 5 star feeling at all
c2500356,s8,To leave the hotel by taxi - it seemed that you had to walk about 10 minutes to get to the taxi rank (although it was probably only 5 minutes) and it didnt feel convenient
c2500356,s9,The casino was inhabited by…
c2500357,s1,The hotel is huge and its very easy to get lost
c2500357,s2,When we arrived there was no-one to guide us through the almost 1km long front lobby
c2500357,s3,So we had to drag our own luggage through carpeted area to get to the check-in desk - where we were told the was a bell captain located at the entrance
c2500357,s4,We just couldnt see it due to the huge number of people there! The staff are not well trained in guiding guests to the locations asked about
c2500357,s5,"It didnt matter where we wanted to go we were always told ""go straight for 10m and turn left!!"" The restaurants had great buffets and the  casino was exciting"
c2500357,s6,The room and bathrooms are huge and the amenities are decent
c2500357,s7,However it was a let down when compared to the Las vegas property
c2500358,s1,i chose this hotel bec i've been heard about it for years besides the amazing photos i saw online
c2500358,s2,"yes the decoration is very luxurious, but the service is not"
c2500358,s3,"they charge $160 for 24hrs internet, however, on my  2nd nite there, i cannot log into the payment page! means that even i want to pay for internet, they don't give me the chance! the IT came to mend for the whole nite yet useless… besides the food is also plain…had 3breakfast, no comments"
c2500359,s1,"Every time I stay at the Venetian in a non smoking room, I can always smell smoke which probably deep into the wall and carpet"
c2500359,s2,The room is huge but I kept feeling its not clean
c2500359,s3,The Venetian in Las Vegas is 10 times cleaner
c2500359,s4,Always long line up to check in or check out
c2500359,s5,"The moment you go down the elevator to the mall, it's super crowded"
c2500359,s6,"We took our one year old and the room has nothing prepared for kid, which was the first time after we travel with our kid more than 10 times everywhere"
c2500359,s7,We have given enough chance to Venetian macau hoping they will improve but I think we will give up from now on
c2500360,s1,This is our first visit to Macao so we chose to stay at the Venetian
c2500360,s2,We arrived there by taking a jet boat from HK
c2500360,s3,It took a short trip from HK to Macao; quite convenient
c2500360,s4,The custom services did not keep us long
c2500360,s5,There was also a hotel bus to picking up and dropping off the hotel's guests
c2500360,s6,"When making an entering to the hotel, the lobby was amazing and it was one of the landmarks for photo shooting"
c2500360,s7,"While waiting for the checking-in service, we were studying the directory of the hotel via a big touch screen machine assisting us to explore all the wings, shops and services offering at the Venetians"
c2500360,s8,"We were staying in the Bella suite which was grand and huge, it comes with spacious bathroom, two glamorous queen beds, a small living  area and the outdoor space where we could…"
c2500361,s1,I was rather disappointed with the hotel
c2500361,s2,"Stayed 2 nights, and wished i have chosen otherwise"
c2500361,s3,"Some staff were friendly, but most staff were not, when asked for direction, they sounded so impatient"
c2500361,s4,"The area is huge, we felt tired walking, after check-im, we have to go from  lobby to 3rd floor, walked like few hundred meter looking for the South Wing, and seems like not many staff around to help"
c2500361,s5,"Room was slightly dated, bathroom does not have hand-held shower, thus making it very difficult to bath our young son"
c2500361,s6,"Shuttle buses go to limited places, unlike the other one we stayed a night before"
c2500361,s7,"When we opened our door room, a guy was doing maintenance work"
c2500361,s8,"Next day, When we went back to the room after a tiring walk, the door lock was spoilt, and took an hour to fix"
c2500361,s9,The…
c2500362,s1,I went to Macau for 1 day after a trip to Hong Kong and was very disappointed and wished I could have turned back and stayed in Hong Kong for 1 more day
c2500362,s2,"Macau is huge, hard to get around, especially in rainy, humid weather and the casinos smelled strongly of cigarette smoke"
c2500362,s3,The Venecian is a huge resort and was a beautiful place to shop and explore but the rooms were disappointing
c2500362,s4,Our room was the cheapest of them all but it was still a GRAND room
c2500362,s5,I liked the spacious living areas and the bathroom was huge but everything just seemed run down and old
c2500362,s6,"While it was all cleaned well, it just all felt a little musty and overused to me and was not the modern resort I would have preferred"
c2500362,s7,"If you're after a grand hotel, its great, but if you're after a nice, clean and modern hotel…"
c2500363,s1,"room is comfy and spacious, facilities are abundant! events and shows are plenty"
c2500363,s2,Food is okay
c2500363,s3,The place is huge and gave an impression that you could get easily lost or at least will be soo tired to walk from one point to the other
c2500363,s4,"I don't quite like the decoration and style that is a little too ""fake"" for me"
c2500363,s5,"I mean, what's the point of riding a gondola inside a hotel?"
c2500364,s1,Without doubt I have never stayed in a more luxurious room in my life
c2500364,s2,Shopping areas casino and food court are all fab
c2500364,s3,A few things missing 1) No one to pick up our luggage at the Macau ferry terminal in face we had to put the luggage in the bus our self
c2500364,s4,On reaching the hotel I had to go inside and ask for the bell boy to come out outside to the bus no one was there to receive us at the bus when it reached the hotel
c2500364,s5,I felt less then welcome on arrival
c2500364,s6,2) After breakfast the started arranging the lunch we were still there after our breakfast
c2500364,s7,A two year old kid was with us it saw a banana on the lunch buffet he wanted it so we requested the manager the can we please have 1 banana for the kid
c2500364,s8,I was shocked when she said no and when she said no she was not polite
c2500364,s9,Other…
c2500365,s1,We arrived at this Grand looking hotel
c2500365,s2,It is positively huge
c2500365,s3,We checked in and were given a map to find our room
c2500365,s4,We really struggled to find it as this hotel branches off all over the place
c2500365,s5,"Our room was nice,besides all the black mould all over our shower, which made me wonder how clean the rest of it was"
c2500365,s6,We wanted to go out of the hotel and catch the shuttle
c2500365,s7,"We got so lost trying to get out, we just returned to our room"
c2500365,s8,The casino is full of smoke
c2500365,s9,Even the non smoking areas stunk of it
c2500365,s10,The gambling was very expensive
c2500365,s11,The cheapest blackjack was $40 AUD a bet
c2500365,s12,We did not find the food hall until the second day
c2500365,s13,That was quite good
c2500365,s14,It was very beautiful and the false sky on the ceiling was impressive
c2500365,s15,Also the Winter light show was amazing
c2500365,s16,For breakfast we were told…
c2500366,s1,After we stayed for two nights at the Sofitel in Macau we wanted to experience the Venetian for a night
c2500366,s2,We booked the Titanic package as we heard it was good
c2500366,s3,When we arrived at the West Lobby confusion started immediately
c2500366,s4,It was literary swarming with people most of them from various touring companies
c2500366,s5,There was no staff to assist us in any way with our luggage
c2500366,s6,We entered the West lobby because that seemed to be the most logical approach to follow
c2500366,s7,We passed a luggage station and walked about 10 – 15 minutes to the reception
c2500366,s8,This is a huge building
c2500366,s9,All that time no staff to assist us in any way
c2500366,s10,When we finally got to the West lobby we found out there was no way to check in early
c2500366,s11,We approached a staff member and with great difficulty we found out that even though there…
c2500367,s1,First impressision is the crowd! My wife literally said are we in a market! No such grand welcome or whatever!  But I had to say I was quite lucky to have a speedy check-in
c2500367,s2,"However, I couldn't believe  that I still need to give the Hotel a deposit (through credit card per-athorisation) as a security for the mini bar even I had paid all room rates in advance (obviously good credit standing) and considered that I justed stayed in 4 stars hotel that didn't even bother do the same! It seems the 5 stars hotel is more petty and small-hearted than the 4 stars!  I had to said the room is gorgeous! No complaint about the space, cleanliness & view"
c2500367,s3,But
c2500367,s4,"the big big drawback is no free wifi or Internet connection in the room or hotel lobby! Again, I couldn't believe this considered…"
c2500368,s1,I have selected this hotel based on recommendation of my friend
c2500368,s2,He mentioned that it is unique and good to stay for one night
c2500368,s3,"If you would like to go and enjoy Casino and like a gigantic size of hotels, then this may be the one"
c2500368,s4,"For me and my mother, who usually prefer staying in a small scale hotel and enjoy exploring historic part of the city, it was too far from the main city center"
c2500368,s5,"The shopping mall attached to this hotel also closed quite early and when we arrived in the hotel in the evening from Hong Kong, we were not able to enjoy shopping"
c2500368,s6,There is nothing wrong with the hotel but it did not match my usual taste and serve the purpose of my visit to Macao
c2500369,s1,We spent a night here on a recent Asia vacation for a little R&R
c2500369,s2,"Huge disappointment for any Vegas fan - imagine a Vegas casino, which looks remarkably like its Vegas equivalent, especially in the lobby; but without any of the partying, drinking, noise making or general raucous fun"
c2500369,s3,"The casino is quiet apart from the sounds of the machines, the gambling crowd is quiet and serious, and there was only one small bar in the entire casino floor"
c2500369,s4,"The rooms are comfortable and clean, and again very similar to the Vegas ones"
c2500369,s5,"The casino runs a bus from the Hong Kong ferry terminal, so its easy to get there"
c2500369,s6,"It does have a Starbucks, thank goodness"
c2500369,s7,"Better still, its open 24 hours if you have jet-lag"
c2500369,s8,"Talking of jet-lag (or not), the gambling clientele apparently sleeps the night on…"
c2500370,s1,"My husband brought me for a weekend birthday stay at the Venetian - we love the one in Vegas, and the Venetian Macau certainly is up to the mark"
c2500370,s2,"We especially enjoyed the ""birthday surprise"" arranged by the Venetian - theymade us feel very special"
c2500370,s3,no complaints as regards the room and the service
c2500370,s4,"My only complaint is that the room, pillows, duvet and sofa had a very stale smoke smell, which just wouldn't go away - even on a non-smoking floor"
c2500370,s5,An air purifier would have been helpful
c2500370,s6,"The stale smoke smell in the rooms has slightly put us off the Venetian, and not sure whether we will perhaps try another hotel the next time we are there"
c2500370,s7,"Other than that, or it you are a smoker, go for it!"
c2500371,s1,My husband and I stayed here for part of our honeymoon
c2500371,s2,The place is absolutely enormous
c2500371,s3,"So big that we didn't even bother going down to the pools, they were just too far away"
c2500371,s4,"Our room was large, with a huge bathroom, and a separate sitting room and a great view"
c2500371,s5,"However, the service was somewhat lacking, it was almost as if the real interest of the hotel is the casino, and the hotel guests are just an afterthought"
c2500371,s6,"We found the smoking in the casino quite off putting, as you often had to go through there to get to where you wanted to be"
c2500371,s7,"Also, there is almost no natural light in the hotel lobby and other areas, which can be quiet disorienting"
c2500371,s8,"There are numerous restaurants and food outlets, and a whole shopping mall in the centre"
c2500371,s9,These were busy most of the time that we…
c2500372,s1,We stayed in Macau just to see how it had progressed as part of our honeymoon
c2500372,s2,We thought The Venetian would be a great place to stay based on TA reviews
c2500372,s3,"The hotel itself was fine, but as others have mentioned - a massive confusing rabbit warren"
c2500372,s4,We tried to find the gym - walked about 800 metres and gave up
c2500372,s5,"If you're looking for night life and ease of getting around, this is not the place to stay"
c2500372,s6,Macau is certainly no Vegas
c2500372,s7,"If you're more into seeing the city and wandering around at night (which we were) you are far better off staying over on the other side, near Nam Vang lake"
c2500372,s8,The Venetian was only really accessible by taxi or shuttle bus
c2500372,s9,"If you do stay here, it is worth going to North - a fabulous restaurant"
c2500373,s1,"We stayed at the Venetian for 1 night, just to experience the craziness of Macau and it's casinos as these huge hotels are not our style"
c2500373,s2,"For such a huge hotel they are able to maintain very friendly and personal service, I was impressed"
c2500373,s3,But for the rest you feel like cattle
c2500373,s4,It starts with the complimentary shuttle bus where you stand in line as cattle to be driven into the bus
c2500373,s5,At the hotel you are in line to check in
c2500373,s6,But they are very fast and efficient
c2500373,s7,"However they forgot to include our 6-year old in the reservation even though I made a note on the online booking form and when receiving the booking confo without the 6-yr old, sending another email"
c2500373,s8,There was nothing in the system: amazing
c2500373,s9,"Anyway, the guy from reception fixed it within 10 minutes and we could proceed to…"
c2500374,s1,I chose to stay at venetian hotel even though i have read about bad reviews bec i was traveling with 2 kids
c2500374,s2,the advantage is that the bella suite has 2 queen size beds that can easily accommodate a family of four
c2500374,s3,"my first tip is this, if u want to save money u can get the cotai room that has only 1 king size bed bec every room has a pull out  sofa bed that is queen in size, just ask them to prepare it for you, they will provide all the trimmings like pillows, bed sheets and blankets"
c2500374,s4,"2nd tip is this, the food at cafe' deco is horrible, i can't believe a 5 star hotel serves that kind of food! yuck! anyway u have 3 restaurant options of free breakfast or lunch"
c2500374,s5,so make sure u eat at Bambu restaurant
c2500374,s6,food there is delicious and clean
c2500374,s7,"just look it ask for direction, it's worth…"
c2500375,s1,I never understood the hubbub surrounding The Venetian Macao until I finally stayed there a few days ago
c2500375,s2,"Upon entering the hotel, the first word that came to mind was ""excess"
c2500375,s3,""" Everything was meant to be over the top"
c2500375,s4,This is like a country in itself
c2500375,s5,"As another reviewer noted, once there, you never have to leave"
c2500375,s6,"It is hard even if you tried, as you can literally get lost among the hallways, fake canals and endless shops here"
c2500375,s7,"The place reminds me of a grand bus terminal, albeit a luxury one"
c2500375,s8,"If you want peace and quiet, this place ain't it"
c2500375,s9,"Actually, the whole of Macau ain't it"
c2500375,s10,You need good walking shoes as you will do a fair amount of walking when at The Venetian
c2500375,s11,"The hotel side of the complex is nothing extraordinary, with decoration and architecture that are more…"
c2500376,s1,A massive hotel
c2500376,s2,Huge long long walk from the elevator to your room
c2500376,s3,but the room was always spotless
c2500376,s4,They must have an army of staff
c2500376,s5,Shame the reception staff don't speak English
c2500376,s6,This hotel has everything you can imagine
c2500376,s7,If you stay here you will never have to leave
c2500376,s8,The shopping centre has not one but three indoor canals you can float down to look at the latest sales and if you have any money left you can go gamble in the world largest casino
c2500376,s9,Not the best hotel but always a great time
