c2500000,s1,"We have been traveling Shenzhen,Hongkong & then Macao totaling 14 days"
c2500000,s2,We had an excellent stay at all our hotels
c2500000,s3,Our last stop was the Venetian in Macao
c2500000,s4,The hotel has 3000 plus rooms and was very busy
c2500000,s5,Since we step foot on the ferry when they picked us up on the shuttle bus at the ferry we where treated like kings & queens
c2500000,s6,Nothing was to small to make our stay WOW
c2500000,s7,#fyi The ferry price was 293HK$ for 2 people going & 800 HK$ coming back
c2500000,s8,BUT when we left
c2500000,s9,The hotel staff was great assisting us with luggage to West lobby for pickup
c2500000,s10,At the shuttle we came across to something that we just could not belief
c2500000,s11,The shuttle came and the staff member (which I think is appointed to assist quest to load the luggage) points and shout Load your luggage under the buss
c2500000,s12,…
c2500001,s1,I always staying here whenever i went to Macau days before
c2500001,s2,and surprised that the room was not too clean but still good and spacious with complete amenities
c2500001,s3,"The food in Macau is double than HK,  and it almost everywhere as that's the city of tourists"
c2500002,s1,Stayed 5 nights
c2500002,s2,"It’s a shame but this didn’t make the grade for us, having stayed at MGM and Banyon Tree beforehand on the same trip"
c2500002,s3,We have stayed at Venetian Las Vegas on numerous occasions and are used to big hotels
c2500002,s4,There are many positives but for us this Venetian Hotel is too big for its own good
c2500002,s5,We do not regret staying but in my view there are better alternative hotels in the area
c2500002,s6,Positives: Iconic hotel
c2500002,s7,Good location
c2500002,s8,"Easy to walk to the old town Taipa, Galaxy and to Wynn Palace"
c2500002,s9,Free shuttle buses to various destinations including other hotels in Cotai
c2500002,s10,Venetian canals and fun theme
c2500002,s11,Checked in 1pm and room was ready
c2500002,s12,Complimentary check out at 2pm which was very welcome
c2500002,s13,"Very efficient, friendly and complimentary luggage storage"
c2500002,s14,Large room with lounge…
c2500003,s1,Pros: Once we were able to check in it was very fast and they gave me a lower floor room as requested
c2500003,s2,Room/suite was the high point of the stay
c2500003,s3,Check out took about 45 seconds
c2500003,s4,Con's: From ferry to shuttle bus is a long walk with no signs
c2500003,s5,Denied early check in
c2500003,s6,No place to set at reception (I'm 74 years old
c2500003,s7,) Front desk wanted 2000MOP ($250us) on a credit card as a deposit
c2500003,s8,"Its a scam were the hotel gets to hold up to $70,000"
c2500003,s9,"in ""float money"" and you don't get your money back on your credit card for weeks"
c2500003,s10,"I declined and refused, and told them it was not advertised when I booked and prepaid, and they understood I knew the scam and they accepted the no payment"
c2500003,s11,After check in they sent us through the casino to get to our room and we had to show our passports(again) and the…
c2500004,s1,Venetian hotel is a perfect hotel and a little bit old
c2500004,s2,The room is very large and well equipped and the room service provides you with anything you want
c2500004,s3,Breakfast is very very normal and not a WOW comparing to other five star hotels and I suggest to take lunch in the asian restaurant and it was much better
c2500004,s4,Hotel is really big and from room to main lobby takes 20 mins
c2500004,s5,Very very crowded and to people who prefer quitter place I suggest to choose other smaller nearby hotels
c2500005,s1,The hotel itself is nice as the rooms are all suites
c2500005,s2,Check in at 1pm and not earlier even when rooms are available is not accommodating guests
c2500005,s3,"Coming from Living in Las Vegas for 9 years where there is fun and excitement at every corner, The Macau scene is built for no fun at all"
c2500005,s4,Its built around Baccarat games for old Chinese men and old Chinese working girls to follow you around and point to open tables as if you cant see them yourself
c2500005,s5,There are only two poker rooms in Macau and the Venetian being one of them
c2500005,s6,With waiting lists full and only 7 tables occupied they will cut down tables and make waits even longer
c2500005,s7,Going to the bathroom and having a line of Chinese drug dealers waiting for everyone is a show itself by the poker room
c2500005,s8,Looking for a bar on the casino floor is…
c2500006,s1,"Oh well, the most of staff are nice esp Ben at front office and Jamie at concierge were very nice and professional with great Eng skill but there was one lady whom were extremely rude"
c2500006,s2,I also work for international luxury brand hotel and could not believe what she was doing
c2500006,s3,"The very good thing abt this hotel, you can enjoy early check in and late check out service with min extra charge"
c2500006,s4,"I also have requested for this service and when I arrived at the lobby, I slowly approached the front desk then she stopped me and yelled at me saying I cant go to front desk"
c2500006,s5,I kindly yold her that I had booked for early check in service and it was around 9
c2500006,s6,30 am
c2500006,s7,Then she said I needed to come back after 12
c2500006,s8,30pm for that service even if I explained everything then forced me and my family to…
c2500007,s1,Stayed here for just one night as we were attending a concert
c2500007,s2,For this reason it was a good choice as our room was very close to the Cotai Arena
c2500007,s3,However rating the Venetian as a five star property is difficult
c2500007,s4,The property is huge and largely dominated by a massive amount of retail outlets
c2500007,s5,"When arriving in the main lobby it was completely chaotic, noisy and again not what I would expect from a five star property"
c2500007,s6,The Check in queue was long and took forever to be served
c2500007,s7,The rooms are big and comfortable albeit a little dated
c2500007,s8,Our so called “non-smoking” room had a strong smell of smoke and even had an ash tray
c2500007,s9,There is a good variety of f&b outlets which you would expect from such a large property
c2500007,s10,"However, prior to departure my wife had money stolen from her bag as we…"
c2500008,s1,"Well Check In process is too lengthy, but stay was average"
c2500008,s2,It has the Asia's Largest Casino floor which is functioning 24x7 (though not full)
c2500008,s3,"The hotel is very big, you need to keep the map with you to find the place"
c2500008,s4,The room sizes are also big enough for stay
c2500008,s5,"The service is not too fast, but acceptable, considering the size of hotel"
c2500008,s6,"If you do have plan to visit in Hotel area, must try Gondola ride"
c2500008,s7,You can find Indian restaurant The Golden Peacock
c2500008,s8,The test is totally Indian
c2500008,s9,"Those who want to try local food can pay visit to Food Court, you can find variety of food"
c2500009,s1,"The thing that struck me about this resort is its size and very efficient service, but still friendly staff"
c2500009,s2,However English skills were not great with the majority of staff aside from check-in
c2500009,s3,So learn some basic Cantonese before going
c2500009,s4,We spent 2 days here and due to the air pollution and not feeling well we did not venture outside and neither did we gamble
c2500009,s5,"We basically window shopped for2 days, walking in excess of 10km/day"
c2500009,s6,The resort is like a small self contained city
c2500009,s7,"There was a nice pool area, but due to illness was unable to make use of it"
c2500009,s8,"One thing to note, if you have coeliac disease, they are not very gluten aware"
c2500009,s9,"We chose to eat at the Golden peacock (Indian cuisine) that offered gluten free meals, but I wouldn’t say completely aware of the…"
c2500010,s1,Its a massive hotel you walk to Many corridor to arrive somewhere
c2500010,s2,I went in Vegas venetian and is really différent
c2500010,s3,This hôtel is Like Disneyland for chineuse adult
c2500010,s4,Breakfast was terrible
c2500010,s5,"Like 2 stars hotel bad quality food, poor choice better to go to starbuck than there"
c2500010,s6,"Room are gréât big suite, very Clean gréât bathroom and wonderful view"
c2500010,s7,To access in swimming pool you have to be courageous you have to walk 15 or 20 min in huge corridor to access in garden
c2500010,s8,Swimming pool are small but Many Like swimming in alcov Its more confidential
c2500010,s9,Bar on swimming was closed
c2500010,s10,The gambling decline table are full with no polite people
c2500010,s11,Mall inside hotel are gréât Like in Vegas beautiful place all brand only food court was horrible smell and too Many people
c2500010,s12,Connections with other hôtel…
c2500011,s1,I guess if the go to Macau you will want to experience the Venetian
c2500011,s2,"So many shops but when confronted by the fact that a soft drinks sells for nearly 10 times the cost in the supermarket, you know you’re not here for the bargains"
c2500011,s3,Just about every fashion shop is here and I guess it’s great to just take in the experience
c2500011,s4,We don’t gamble so the casino isn’t of any interest
c2500011,s5,Still go and see it but lots of better things to do in Macau
c2500012,s1,huge hotel
c2500012,s2,takes a week to sort out
c2500012,s3,with lots of shopping ( expensive) snd connected to other resorts
c2500012,s4,"however breakfast way below average, pool takes ages to reach and not much fun"
c2500012,s5,casino also quite expensive compared to Vegas
c2500012,s6,Macau itsrlf was a pleasure however
c2500013,s1,I only give this a 'fair' rating because I wasn't impressed by the bling and poor imitation
c2500013,s2,"Don't get me wrong, it is a fantastic spectacle, huge complex with something for almost everyone, a real eye opener"
c2500013,s3,"Even though it is fantastic, I felt cheap and dirty by walking through a faux St Marks Square, Grand Canal, Bridge of Sighs, gondolas etc, etc, etc"
c2500013,s4,"It is a masterpiece in architectural mimickery, but just a bit wrong"
c2500013,s5,You have to see it if you go to Taipa
c2500014,s1,The Venetian Macau can be summed up in two words - ‘Too busy’
c2500014,s2,Getting from the front door to our hotel room lift always involved a battle of managing our way for the long walk through hundreds of people in the casino
c2500014,s3,It is by far the busiest casino in the Cotai strip compared to all the other casinos we visited
c2500014,s4,On the positive note our room was very big and the room service excellent
c2500014,s5,However the bed was hard and we did what we could to make it softer
c2500014,s6,Also the while the Casinos/Hotels are newer on the Cotai Strip we found it difficult to navigate our way around and finding bars and restaurants on the street were virtually non existent
c2500014,s7,I much prefer the Las Vegas Strip for walking around and visiting the various Casinos and restaurants and bars
c2500014,s8,All in all while we still…
c2500015,s1,We stay 3 nights to experience area
c2500015,s2,Hotel is very large
c2500015,s3,3000 rooms
c2500015,s4,Suites are big and very clean and well maintained
c2500015,s5,We chose breakfast at Cafe Deco Restuarant
c2500015,s6,Unfortunately there was no variation of the breakfast for the 3 day stay
c2500015,s7,The restaurant didn’t cater for guests that don’t eat pork or beef
c2500015,s8,Food was prepared for large crowds and attention to detail was lacking
c2500015,s9,The hotel has a damp problem which smells bad
c2500015,s10,They are using machines to dry the carpets
c2500015,s11,We not sure if it’s working
c2500015,s12,Overall the hotel is very busy
c2500015,s13,I would avoid the hotel if you staying with family
c2500015,s14,The Parisian hotel seemed better
c2500016,s1,"The place was absolutely beautiful, wide range of places to eat at quite affordable prices"
c2500016,s2,Downside is that the service on the gaming floor is very poor
c2500016,s3,I had the service light on for over 15 minutes to get some water and no one ever came to me
c2500016,s4,At one point the machine malfunctioned and it took over 5 minutes for someone to come and fix it
c2500016,s5,"If we had not asked a lady carrying drinks about it, I think we would have been left in the same situation as above and been waiting indefinitely for someone to come by"
c2500016,s6,I visited about half a dozen casinos during my time here and this was the absolute worst in terms of service
c2500016,s7,It would be 2 stars if it weren't for the fact that the interior of the building is one of the most beautiful here
c2500017,s1,I had my 8 month old daughter with me during my stay and visit last year
c2500017,s2,"While walking through the Shoppes, my daughter has dirties her diaper"
c2500017,s3,I took her immediately to a (male) bathroom to find no changing table is available
c2500017,s4,"I walk back outside and locate a staff, who tells me there is a family room very far from where I am"
c2500017,s5,"He could not tell me the exactly location, only the direction"
c2500017,s6,"After walking a few minutes, holding a baby with dirty diaper"
c2500017,s7,The overhead signage does not show there is a family room
c2500017,s8,I find another staff who did not know the location of the family room
c2500017,s9,We walk some more and could not find another staff to ask directions to the family room
c2500017,s10,Fifteen minutes have passed and I don't want to risk moving around more and have the diaper overflow onto…
c2500018,s1,Yea it dose not worth it
c2500018,s2,the room are outdated
c2500018,s3,"old style , sure you can not compare it with the one in Vegas, very crowded and so noisy"
c2500018,s4,you can book with any 5 stars hotel in the neighborhood
c2500018,s5,very expensive compared with the quality of the hotel
c2500019,s1,Very high-end place
c2500019,s2,"Gondola is expensive, hence not really worth it"
c2500019,s3,"I have been to the Venetian in Las Vegas many years ago, so yeah more or less the same except for the crowd (like millions of people at night in Venetian Macau)"
c2500019,s4,"Overall, it was okay"
c2500020,s1,The Venetian Hotel in Macau is one of the oldest hotels and this you experience by the  smell of moist in the venue
c2500020,s2,"The rooms are extremely spacious but ""dated"""
c2500020,s3,The decoration is as it was 20 years ago
c2500020,s4,"The beds are huge and the mattresses are medium-hard, yet comfortable"
c2500020,s5,The pricing is a bit expensive for what you get
c2500020,s6,"If you prefer a more modern decoration and/ or prefer high level of cleanness, I recommend to look around at the other hotel, but if you like to have an extremely spacious room, The Venetian is offering you that"
c2500021,s1,The hotel room was comfortable and with good facilities
c2500021,s2,"However, the overall experience was rather overwhelming! The hotel morphed seamlessly between hotel, shopping centre and casino-great if you are into a Las Vegas experience, but maddening if you just want to find the breakfast room"
c2500021,s3,"If you want a bit of a surreal experience, with mock St Mark square and gondolas, this is the place for you!"
c2500022,s1,We stayed here for NYE as a 1 night trip from the rest of our trip in Hong Kong
c2500022,s2,"I think if you have been to Vegas, Macao will be pretty disappointing overall"
c2500022,s3,The Venetian is nice but nothing special
c2500022,s4,"Its a big hotel, the casino is crazy busy and trying to do anything or get out the hotel takes ALOT of time"
c2500022,s5,The rooms are nice an clean
c2500022,s6,We didn't get the view that we had booked which was disappointing
c2500022,s7,"Was it nice yes, would i return no!"
c2500023,s1,The Venetian was all that Ithought it would be
c2500023,s2,The suites are roomy and very comportable
c2500023,s3,Each hotel/casino that we visited was offered a different experience Macau however is void of the energy that one usually finds on the Las Vegas strip
c2500024,s1,We went to Macao for a few days and stayed around the hotels and casino area
c2500024,s2,"Venetian Resort is an astonishing and absolutely luxury hotel but looked very commercial and ""fake"" to us"
c2500024,s3,It looks like you are entering a giant shopping mall where you are sure you are going to waste your money
c2500024,s4,"Go to real Venice on Carnival, you will see that canals are a bit different and romance is another thing"
c2500025,s1,"we Had a suitem, place is extremely busy and very BIG, be prepared to walk many miles to get anywhere! Golden peacock Indian restaurant food and service is very good!!!! please book, tables are limited and gets v bust quickly shuts at 11pm"
c2500026,s1,We booked the Premio Bella Suite
c2500026,s2,"Overall the room is good,  we got  the 2 double beds and with a large sofa"
c2500026,s3,"The room is clean, we love the interior , bathroom has a vanity console table  and a separate bathtub and toilet"
c2500026,s4,We stayed at the Parisian Hotel for two nights and transferred to The Venetian on our third day in Macau
c2500026,s5,"The two hotels are just 5 to 10 minutes away, we just walked tru the connecting hallway going to the Venetian"
c2500026,s6,There is a shortcut way but must pass tru a casino
c2500026,s7,"Not advisable if you have children 21 years below, the guard wont let minors go in /pass tru"
c2500026,s8,Upon check in the line was so long
c2500026,s9,It was terrible
c2500026,s10,"While my family are waiting for me,  there was no place where they can sit or wait, so they are just standing at the lobby"
c2500026,s11,The whole lobby was…
c2500027,s1,I stayed there with family on the weekend
c2500027,s2,The queue for check in and check out is long but they handle it efficiently
c2500027,s3,The room is huge with 2 queen bed and living room
c2500027,s4,I lost my way many times to find the elevator to the room because the  entries blend with the mall
c2500027,s5,"However, I found it good thing so i could explore the mall"
c2500027,s6,I got option to have my international breakfast or chinese lunch and opted to have chinese lunch
c2500027,s7,Not a long queue in the chinese restaurant but had to wait 20 minutes because they didnt let my kids in while i explained them many times my reservation for 2 adults and 2 kids and got the confirmation when checked in that I entitle for 2 adult and 2 kids meal tickets
c2500027,s8,That just ruined my mood for this hotel
c2500027,s9,So my suggestion for the hotel is to provide…
c2500028,s1,Stayed in Venetian for two nights
c2500028,s2,The huge rooms are the only thing positive about the place
c2500028,s3,Check in took so long
c2500028,s4,"They are a 3,000 bedroom hotel so one can just imagine"
c2500028,s5,A lot of Chinese Mainlanders smoking and coughing without covering their mouth
c2500028,s6,Better wear a mask
c2500028,s7,Its just mayhem in the lobby
c2500028,s8,Shouting and talking loudly
c2500028,s9,Requested for non smoking room/floor
c2500028,s10,But still the smoke smell is evident
c2500028,s11,There's a food court and  nice shopping arcade all in one roof
c2500028,s12,But can get the feeling of being claustrophobic
c2500028,s13,"Again, too many people coughing around"
c2500028,s14,Was almost ripped off by a taxi who refused to use the meter
c2500028,s15,It was a good thing the Venetian staff warned us about such cons
c2500028,s16,"Thanks to all the Filipino staff, especially Rose of the concierge for being…"
c2500029,s1,This is definely a resort with great facilities and manmade art building and pieces
c2500029,s2,You can see a small Venice life style here
c2500029,s3,"Maybe the hotel is too big and staff is too many, the service average is under expectation, but you cannot say it's low"
c2500029,s4,We see the sands group brand so we expect more
c2500029,s5,"Anyway, this place is the one you must visit when you come to Macau"
c2500030,s1,I stayed at the Venetian for a weekend away in Macau and was disappointed
c2500030,s2,The location was nice and it was close to other resorts and shopping areas
c2500030,s3,The casino was huge and it was fun to gamble a bit
c2500030,s4,"The hotel in general was gigantic and it was hard to find my way around, even with a map"
c2500030,s5,"My friends and I booked a nonsmoking room, but our room smelled smoky when we were in it"
c2500030,s6,"I contacted hotel service so they could fix the problem, but they did nothing"
c2500030,s7,"All of our clothes, sheets, and towels smelled like cigarette smoke"
c2500030,s8,We ordered new towels and pillows to the room our second night because of the smell and it took over 45 minutes for an employee to bring us our new towels/pillows
c2500030,s9,"Though it was a nice hotel, I would chose a different place to stay at next time"
c2500031,s1,I know it wasn’t in the USA but apart from the building nothing was like the Venetian in Vegas
c2500031,s2,It was aimed definitely at the Asian market (no problem with that) but it didn’t really suit us
c2500031,s3,"Difficult to find a bar (one in the hotel) food court was a fast food heaven so good for the young people, and some restaurants (definitely recomend the Italian but you have to hunt for it"
c2500031,s4,"Casino disappointing, lots of people sitting on phones not really bothered with the casino aspect, again maybe an Asian focus on gambling here whereas Vegas is more fun"
c2500031,s5,Not sorry we went but nothing like the real thing
c2500031,s6,Think the disappointment with Macau itself may have biased our view of the hotel
c2500031,s7,Staff were friendly and mostly tried to help with problems we had
c2500032,s1,My trip was in October 2018 and have reserved a room for 3 people (1 king bed with sofa bed) for my family
c2500032,s2,"As the hotel has my reservation record of 3 guests name, and the staff in front desk also acknowledge the information, I expect the hotel should get ready 3 sets of all amenities (such as tooth brush, towel, pillow, water, & most important slippers!) in the room before assigning or even check in the hotel"
c2500032,s3,This is a little bit disappointed that a luxury hotel should not have such service
c2500032,s4,Should not let the guest ask for more if something that the hotel already knows
c2500032,s5,"Luckily, the housekeeping attendant in the corridor do a great help for us! Really appreciate her help!"
c2500033,s1,"Let’s start with the good things, check in was smooth, used express check in to avoid the wait reported by some"
c2500033,s2,Requests for non-smoking and a high floor were both met and a late check out was offered
c2500033,s3,"The hotel although very busy is well presented and clean, the facilities are excellent"
c2500033,s4,Everywhere we ate was to a good standard
c2500033,s5,"The room did however still smell of smoke a bit, we didn’t report it as it was only 2 nights and an effort to move, also the toilet wasn’t working but was fixed swiftly on request"
c2500033,s6,"Not a problem really  At this point I was happy with the stay, checkout however was very disappointing"
c2500033,s7,"First of all they couldn’t work out the bill, this carried on for over 10 minutes with a supervisor being called (it wasn’t complicated)"
c2500033,s8,Then it emerges that the…
c2500034,s1,The hotel is huge but overly crowded with many many tour groups
c2500034,s2,The lobby is very congested like a busy train station
c2500034,s3,"I booked directly on their website for one night, 2 queens beds that includes early 10am checkin and late 4pm check out"
c2500034,s4,"However when I arrived 11am at the West end lobby, the worker who guides visitors at the checkin desk informed me there’s no checkin allowed till 12pm and disallowed anyone approaching the checkin desk, even after I explained to him that I completed the online checkin registration with QR code and received email confirmation on the express checkin"
c2500034,s5,I still complied and returned to checkin in the afternoon instead
c2500034,s6,"During the checkin, they even tried to deny my late checkout privilege that was included in my booking because she explains…"
c2500035,s1,"Everything and more than we expected, was our room"
c2500035,s2,We'll be back
c2500035,s3,"The Venetian has so much to see and do, wide choice of restaurants, and entertainment options"
c2500035,s4,We were there for a concert and found the convenience and welcome most encouraging
c2500036,s1,Had a good stay here for around a week
c2500036,s2,"The room is spacious and mostly clean, except that the bed seems to have bed mites (I got two bites in my arm during my stay, asked the sheets to be changed twice but didn't happen), the room/curtains is a little dusty because it triggered my allergies, and the toilet doesn't seem to be cleaned that well because it doesn't smell so good even after housekeeping has supposed to be cleaned it"
c2500036,s3,The room service and housekeeping are responsive and polite
c2500036,s4,The gym is perfect with complete equipment and helpful staff
c2500036,s5,The pool is not that ok
c2500036,s6,"A large part is under renovation, while the rest of the pool areas has an unpleasant smell"
c2500036,s7,The shops and restaurants are excellent
c2500037,s1,Beautiful and nice hotel but the front desk person was not friendly when I made check in
c2500037,s2,The room  was big and clean
c2500037,s3,The bed was very comfortable and I had very good sleeps for two nights
c2500037,s4,The only drawback for the room facility was water pressure was pretty low for the shower
c2500038,s1,Perfect place to stay when you visit macau
c2500038,s2,The room is amazing and everything luxurious
c2500038,s3,We got north suite wing Easy to reach from ferry terminal
c2500038,s4,Varies of food from different country easy to find
