Content,Rating
"Don't  even know where to start, was mortified by my experience with Sheradan in Macau.  1) checking In: the front desk, had a massive had time, almost walked out kind of bad. As a VIP SPG member, Never  received such bad attitude. Maybe she was just having one of those bad days. 2) cigarette buds inside of elevator, enforce and even after I return from my evening run (2 hours) 3) night staff did not check if I was a hotel guest just let me walk right in, and screamed out "" what floor are you"", from the other side of the corridor. 4) there were no water left in the ladies locker room, the cleaning lady said ""there's water outside"" that means we don't need to drink there, there's water outside of the locker room.  If I had to give points to this hotel, it would be minus, we would…",10
"I have stayed here twice now...once because someone else booked and the second time because our friends were staying there so we moved over from Banyan Tree (which is amazing).  Checking in is like a cattle market or a pig farm...being herded. No warmth at checking in.  Rooms are 3* at best and the pool is terrible...the ONE major strength was the spanish restaurant buffet..yet i had a jug of sangria spilt on me first time....no problem accidents happen.  Second visit the chefs gave such tiny portions and also i was pulling fat out of my mouth or cutting loads of it off....  Anyway, one thing will always stick in my mind. We had a late flight so checked out and went to venetian...when we came back for our bags..  1-- The staff said my signature was different so wouldnt get the…",10
"Arrived at the hotel and had thought arriving at the refugee camp. The foyer is full of people, maybe the foyer was not designed large enough to cope that large amount of tourists coming through, having the casino sharing the same entrance with the hotel. I arrived at the hotel at lunch time and there was 3 lanes deep of cue at the front desk with people wishing to checkin and check out. I went to have lunch first and came back at 1500 and the cue was still as long as before. All counters were open and slow checkin was not helping at all. We waited in the cue for good 30min. I booked two rooms for four people and our rooms were not pre-assigned, meaning they were prepared to give us our rooms on different floors, unless we take the smoking rooms.   The room was considered okay,…",30
"There was a problem in the toilet, and the water was stuck and it was water in the whole toilet after my wife took the shower. It's like flooding in my hotel toilet. Unfortunately it happened at 10:30pm, I called technician to fix and also asked the housekeeping to clean up asap! I warned the housekeeping to take off the shoes because I am not sure how dirty was the water in toilet. The housekeeping simply didn't listen, all 3 housekeeping ladies were wearing shoes and I guessed it made the carpet dirty!  It's now about 12am, and I asked if they have a room for me to change, it seems no one cares in this hotel! My kids are still waiting for them to clean up! They are just 3 and 6 years old and they are very sleepy!  btw, I talked to the duty manager and seems she didn't care as…",10
"We didn't realize how huge the commercial complex was until we arrived. It was the longest check-in queue ever. Luckily, the waiting was not too long. Our receptionist seemed a bit restless, which made me a little nervous - did I make a booking mistake?! I handed him our booking voucher and IDs but he only took one look at my husband's ID, as if he was too busy to check the other things I handed him. Instead, he did some typing, stared at the computer and asked a few times, ""You are Mr. Ho and Ms. xxx? Booked for x nights?"" until he got the right one. How hard was it to just look at my ID and find my name as well in his computer? I surely didn't like being called different names and being asked if it was me at the start of a birthday get-away trip.   And then Sheraton saved it…",30
"This is the train station of hotels (though possibly not the only one in Macau) with little style, little service but a lot of rooms!.  I didn't have a room pre booked, and they said they were full (I was there with friends) but they suggested trying online agents - which I did in reception, where they had lots! Seems crazy to have to book online in front of the booking desk that was ''full''. I booked a suite, they didn't get confirmation from agency so I got a standard room which was OK and the following day moved to the suite which was HUGE.  they tried to bill me for both nights in the suite mind - sorted a couple of days later.  all seemed a bit of a mess.",30
"i stayed just one night from 12-13/11. as expected, the room is up to standard, location is fine. but what amazed me was the huge group of china tourists crowded in both front desks to check in!! this seems to happen everyday! i queue up to check in for 45 min!  this phenomenon was not observed in other neighborhood hotels. i felt a bit uneasy when queue up among all these mainland people, coughing, speaking very loud on cell phone around you, next to you and appeared as if they did not understand the meaning of staying in a queue.....i will certainly choose another hotel next time to avoid this suffering.  the Gym was far away from my room and easy to get lost on the way.... one good thing is the speedy check out system...otherwise cannot imagine!",30
"I spent 3days in Macau and 1 night in Sheraton.  This was to celebrated my husband's birthday.  I appreciated the hotel upgraded me to Family suite and the complimentary gift.   However, what made me so impressed was the integrity of the staff!  I checked out at the Sheraton and went to check in Holiday Inn immediately.  Afterward, I found my trouser was left in the room at Sheraton and came back to Sheraton 2 times in next day to ensure if it was possibly a different person would kept my trouser.   What the answer I got was ""It was not found."".  I was so disappointed cause it is the 5 stars international hotels group but some of their staff are dishonesty.   My trouser is not a famous brand nor a high value but why its staff are unreliable?   It was definitely in my black list…",30
"I am an SPG member and booked for myself and family. I also requested a wheelchair for assistance for my spouce and a room near the elevator to avoid the long walk in this large hotel. I had to stay back in Hong Kong and my family went directly. They reached at 3pm at the hotel with the Reservation detail. Meanwhile i had phoned at 3.30pm to enquire if they checked in and when informed room not occupied i was a bit worried. I informed Guest relations and reservations on the phone that my family will be checking in and i will come later. They said noted and i also reminded about room near elevator and wheelchair, again said request there and noted. I made a total of 4 calls between 4 & 7pm and till that time not checked in. Unfortunately my wife had a HK phone which was not…",10
"Our first impression of Sheraton Macao Hotel was too crowded; there are so many people in the lobby area and even with so many people service is above average.  Luckily as we are Starwood members we were checked-in in the Club Lounge with less people.  The room is nice, clean and good in size.",30
"I stayed at Sheraton Macau for 3 nights. We ordered coffee capsules which was scheduled to be delivered to us at the hotel during these 3 days. As we went with a group tour, our names weren't match with the reservation name because tour guide had rearranged new room for our family to stay on the same floor. We then talked to staff at the concierge desk about this situation since the first day that we had arrived. We provided them room number, our names, order number and pretty much everything. We reconfirmed with the staff many times but they refused to collect our parcels when it was delivered to the concierge desk. The reason given to the carrier company was that the name did not match with the reservation name even the room number and our names were shown on the parcel.  …",20
"I have stayed here twice. Last year, I booked a room for 4 persons on SPG's website, made it confirmed by e-mail from the hotel that the room was for 4 persons. But, they gave me a room with just 1 king bed when I checked in. I was flustered, and the reception said that they don't have a room for 4 persons except for a suite. To make matters worse, they suggested me to upgrade to a suite with additional pay because all the deluxe rooms were fully booked. Anyway, they put some extra beds in a room and I had no other choice. I had complained, and Guest Service Manager offered me a complimentary room upgrade for next visit. I had another chance to visit Macau early in Jan. This time I'd booked a room and asked the Guest Service Manager if the last offer was still valid. He didn't…",20
Was expecting more from sheraton. The building and rooms are a bit old and wornout. I guess is just good for location and casinos. is conveneient but not that delightful for the rooms. For this price  i believe i can have better options,30
"We booked this hotel after losing a passport; we originally spent the night at another hotel but the rates were not within our budget for multiple nights so we decided to move over to this hotel.  We arrived early but rooms were available so they let us check-in. We used room service and the food was mediocre but it satisfied our late night hunger. The rooms themselves are clean and pretty large but they could use some updating. The hotel is HUGE so there is not a very personal feel, but that was to be expected.  Added bonus for pictures with Shrek!",30
"While the hotel is clean modern and the rooms are good, it just feels like the hotel is not up to the standards of a typical Sheraton hotel elsewhere. Situated on top of a casino with crowds coming in and out every day, the place is busy and you don't feel as if you are in a luxury/Exclusive hotel (well they certainly have not priced it as a luxury hotel I have to agree). The check in queue was very long and you feel being rushed. Everything is some distance away, including the walk from the check in desk to the lift where your room is.   Other than that, there isn't much to complain about the room I guess, it is modern and clean.  There isn't much they can do to be honest, this is one of three (4 soon) hotels on top of a massive casino and is designed to provide affordable beds…",30
"I visited the Sherton Macao Hotel during summer holiday with kids. When I arrived, they check in area had a very long queue, I guessed there was over 300 people in the lobby waiting for check-in. There was some staffs to maintain the queue in good order. I waited more than one hour to get the room key. The front desk staff was too tired to offer a smile. Not a warm welcome. The room was clean, I had left a top in the room afte departure however no one contact me for the lost and found during my stay. Perhaps the Housekeeping was too busy? The room package included daily breakfast or lunch. The food and service in Feast was very good. The hotel had shuttle bus to Cotai ferry, however the other hotels would have shuttle bus to other areas in Macao. We had to take taxi when we went…",30
Sheraton Macau is one of the lowest grade hotel for this brand. Stayed there 2 nights and cannot believed they used such low end  products across the room. The shampoo and soap are unbelievable cheap. There is No security at all. Anyone can get access to all floor as they do not have lift control.  This is one of the lowest standard of  Sheraton in Asia,30
We had a good experience here despite the check-in line being ridiculously long. The staff were very accommodating. The room was great and we had a nice view of the pool. The bell boys helped us explain to the cab driver where we wanted to go and gave us a small card with translations to help us better communicate with the driver.,30
"I was not enjoy my stay on 24~28 Oct, no show on 24 Oct,then check in on 25 Oct, reception counter full of staff but look so messy, receptionist seem like not so familiar with the system, after i enter the room, found a soap (used) on laundry basket, 27 Oct i back to room at night, room simply clean, found cup and coffee pot unclean, bed sheet like unchange, dust on carpet, seem no vacumm at all, and room svs tray still on the desk, no one take it out, so i put outside my room, but when i check out this morning, still at the same location, i don't know the standard for extend guest and new guest, that's make me quiet disappointed. I don't think i will stay there again. ",20
"Stayed for 3 nights. Booked on a Club Loung basis. The check in located on the 4th Floor is designed to give a superior experience this was not the case. There are potentially 8 check in positions, at the time of our check in only 2 were in use. One of the two was dealing with a client on a protracted matter the other was the sole interface with the new registrations, the time spent waiting was in access of 20 minutes. I consider this to be unacceptable. Our Club Room was on the 31st Floor, for a 5* hotel this was dissapointing and the room  can only be described as basic and underwhelming, certainly not to the standard I was expecting. On a positive note the arrangements in the Club Lounge were very good with light refreshments , tea , coffee and sandwiches available in the…",30
"My family and I stayed in a family (2 bed) suite last month, and were incredibly underwhelmed by the Sheraton. We came on a busy weekend with a Bon Jovi concert in the neighbouring Venetian, so when we walked in at 3.30pm the queue for checking in must have been an hour long.  We were ushered to an upstairs check-in area, which was only a HALF hour long! Upon checking in we were told that our room was not ready yet, and were shown to the lounge, where we were provided 1 drink each - there was no food, and by this stage the kids were hungry and miserable. The suite was quite nice, with bunk beds for the kids and Madagascar themed accessories for them too.  Wi-fi was poor throughout the hotel, even in the room. The breakfast area was about a half-hour walk from our room to the…",30
"We chose this for a short break with our 4 year old twins. First impression was a chaotic lobby and long queues but we were quickly ushered upstairs to the SPG lounge by an attentive concierge. It saved embarrassment that I am actually an SPG member... I'm happy to carry my own luggage, which I guess was a relief as no help was on offer (a first for me - normally there's an embarrassment of service in that area). Adjoining rooms were good and the kids' room was bedecked with Dreamworks themed goodies, which was great and one of the reasons we had chosen the Sheraton. We set out to explore lunch options. Poolside bar menu was sparse, as was the service so we elected for Bene, the Italian on the first floor. Generally pretty good although the waiter got a bit pushy when we only…",30
i had kept my pasmo/ suica in the card slot. upon returning to my room it was taken. i searched high and low before confirming i needed to contact reception. house keeping found my pasmo/ suica and returned it to my room.  (now i am going through my bags ensuring nothing else has been taken 2:30am)  Thanks for a good nights rest. (sarcasm),20
The hotel was lovely but our holiday was ruined and very disappointed with the check out service. We paid a deposit on arrival and were told we would have the amount credit within 24 hours back onto our credit card it was a moderate amount. 3 and half weeks later I was still trying to get that money back I could not get any satisfaction from emails etc. so disappointing from such a large well known company there was a huge mix up and paperwork missing not good enough I will never stay at a Sheraton hotel again I have never had this problem ever all over the whole world,20
"I had a early Ferry 🚢 from Hong Kong to Macau (澳門) and go to hotel by their shuttle Bus 🚌 🚌. As a SPG member I go to the SPG counter to check in although I booked the room through travel agent.  I understand the earliest time to pick up the room is around 15:00. So I put my luggage at bell service. Friendly SPG staff marked down my phone number and he said hotel will SMS me when the room is really. At last I do not receive the SMS at all.  I come back to hotel around 23:00, I go to pick up the key at SPG counters as well. Everything is fine. When I go up, I hear some noise inside my room, then I use my key to open the door. I found that a staff is setting up my extra bed which I ordered before...   May be I didn't book through SPG for the room they do not give me a SPG room…",20
"Stayed at Sheraton Cotai from 24-28 Sep 2015.  The check-in line was very long, luckily as our group consist of 2 young children (1 was done with fever) and 2 late sixties seniors were directed to the express check-in.  I find the hotel concierege are really helpful whenever we approach them for assistance.  We would suggest that families with young kids to stay on the peninsula side and most of the tourist spots are located there.  The Cotai area is mostly for people visiting the casinos.  Our family enjoyed the fantastic House of Dancing Water show.",30
"This is my third time to stay at Sheraton Macao, I am fine with the hotel location, facility and the room is nice.  I had a very disappointing experience - when I check out, I told the reception Miss Chow/Zhou I loss my deposit receipt then she gave me a long face to calculate the deposit balance, then she ""throw the money"" on the reception desk. I felt embarrassing, I need to meet my friends so I didn't raise complaint to her manager.  Very disappointing service I hope Sheraton to improve their service level, therefore I have to give them only 2-star.  To clarify: this time my room is not complimentary by the Casino, I book thru agent.  ",20
"The problem with this hotel is that it is so massive and loses its exclusivity. It is becoming a really sleazy hotel. There are two towers with a casino at the lobby. I went there during the China National Day holidays, and boy oh boy.. It was so crowded at the lobby.   This is my third stay in this hotel, and I have no idea why I was put at Sky Tower again. From my observation, it seems that Caucasians were placed in the Earth Tower while Asians, which I am one, were placed in the Sky Tower. I have never been into the Earth Tower, and hence, can't really comment on the layout, decorations etc. But what I can comment on was the quality of guests in the Sky Tower. I was placed on a no-smoking floor, and the first thing that I saw when exiting the elevator on my level was a…",20
"Getting to the hotel from ferry terminal – Free shuttle bus is available at both Macau/Taipa Ferry Terminal. Is very easy and convenient to get to the hotel.  Check in – First, the building is large and we walked a long way from the shuttle drop-off point to the front desk. Signage is unclear, we were unsure where to go, lost a few times and finally found the check-in counter. To our dismay, the queue to check-in is extremely long! We don’t expect this from a 5-star hotel. The area was crowded with people and very noisy. The classy feel of a 5-star hotel was lost at that first sight. We are a family of 3, my husband, myself and our 18 month old boy. While I joined the queue to check-in, there is no waiting lounge or couch around the lobby area for my husband and baby to sit and…",30
Horrible stay. Save your money. This hotel had the dirtiest breakfast buffet I have ever seen. Also the service is far below the other hotels. I will never stay at this property again. Ask for non smoking king yet room smelled of smoke. Overpriced should be a one star motel not even hotel rating.,10
"Keeping in mind this is the biggest Sheraton Hotel in the World, in a tourist hub like Macau, you clearly have to make certain concessions. Clearly you're not going to get away from the crowds, nor should you really expect to, but certain things which could help aren't particularly thought out. The Sheraton Club for example is MASSIVE and there isn't a slight air of exclusivity - the dining area just feels like another hotel restaurant.   As a platinum SPG member I was upgraded to a very comfortable suite and the service was rather good. I ordered an item from the daily menu after 11pm and the staff had no issue at all bringing it to me.   I think if TripAdvisor allowed half ratings this would be a 3.5/5",30
"Honestly, I cannot follow many of those who posted the review here on Tripadvisor... but so be it! I just stayed recently at it was most likely by far the worst experience I had in a so called 5* hotel over the past couple of years. It starts already with the feeling of being a number instead a guest that you have to line up for check in...that alone is already not 5* but the fact the the check in process is slow and many counters are not manned is another fact. The check in was not organized at all and took over 10 minutes leaving the waiting time aside. The staffs was not well trained neither customer oriented.  That the lobby has no charm as it is permanently overrun by game machines is a fact that you have to accept when you are in Macau... The whole ambiance just feels odd.…",20
"The hotel itself is pleasant but there's 1 issue with the room.  The shower area will flood while taking shower.  We request the hotel staff to check it in the morning while we are going out and they promised to check.  But when we are back, it did not fix.  We also did tried to call the servicing line but the phone was spoilt.  We're not able to call out.  So we left a note in the toilet to request them to fix it.  There's no response and not fix.  So we bare with it for the 4 nights we stayed there.",20
"The first time I stayed here is few months ago, which I just keep moving around, don't really have time to look up the hotel at all, but I got a good first impression back then. The check in is fast, the lady upgrade me to suite and she was sweet and considerate, it got nothing to do with the elite status yet.   So few months later I returned and stay here for one night for the concert, it turned out to be a huge disappointment. I arrived at 1800 and it's packed, due to the public holiday and mid-autumn festvial, the place is totally packed. So I went to the SPG counter, the queue is long and there's only two staff at the counter, and they took ages to finish one check-in, one even keep chatting with the customers on and off. I was in a hurry to fresh up and go for the event.…",30
"Stayed for 1N over the Mid-Autumn Festival. Crowded time to be there but expected better from a 5 star hotel. The Good: -fast, efficient check-in for SPG members, same for check-out at club lounge  -fast, efficient service by housekeeping when attending to our requests given the size of the hotel. -nice large room -Special mention to Edmund Yong (hope I got your name correctly) at the Club lounge). Our luggage was sent mistakenly to Bell services even though we requested otherwise. He went down with us and personally ensure everything was in order. Thank you Edmund. The Bad: -the so-called club lounge is the worst I have ever been. zero exclusivity with a huge dining area which serves mediocre food. which club lounge has such a big dining area where half the hotel guests seem to…",30
"Stayed for one night due to Bon Jovi concert ( across the road at the Venetian ). This Sheraton claims it is the biggest Sheraton in the world and since they have so many rooms / visitors; they need to have system to match the crowd over the weekends. Basically everything works like clock work ( impressive ) but food is disappointing ( bland ). Otherwise, sleep quality was good ( good bed ) but the mini fridge was locked and could not get a drink!",30
"Check in and check out is way too slow (even on SPG only line). I am not sure why the hotel staffs need such a long time to complete a standard procedure. Swimming pool Jaya is close most of the time, disappointing since you pay full price but availability of some amenities are just half of the time. Shower head hose is leaking a lot. Positive points: very helpful room service, trying their best to help to provide alternative for baby crib (unfortunately unusable as the rail guard is set to lock and cannot be opened), provide plenty of extra drinking water bottles without much questions asked. Most staffs can speak English ok. Room and hotel condition & cleanliness in general are good. Did not try the hotel restaurants, unfortunately dining options at the adjoining mall is…",30
"We booked to stay for my birthday, we were staying 2 nights here and then 2 nights in Hong Kong.  This was the 5th time we have stayed in Macau but the first time at the Sheraton, we were debating if we should try this hotel or stay in our favourite which is the Venetian Hotel and we made a big mistake picking this hotel. We checked in fine, the receptionist was friendly, we loved the room so it was a good start.  However then the hotel had major issues with power outages, we had to get ready for dinner with no lights the first night, the next day (my birthday) the power went again in the afternoon, there were people stuck in lifts screaming and crying, others couldn't get into there room because the keycards weren't working. We came back around 2am and there was still no power…",10
"There are smoking rooms floor at this hotel but I don't smoke. The room was not worth that much money, probably because of weekend. The breakfast cost 217 HK$ at door and 179 HK$ at checkin. The entertainment playground is rather small with limited tables. It's better go there at day time with less players.",30
