Content,Rating
"We are SPG Platinum members and we are deeply disappointed with this hotel. We came here for some rest and relaxation but instead of relaxing by the pool, the security at the pool has been haranguing us nonstop. They have a new (and STUPID) policy where if your child is under 140cm, they MUST wear arm bands and an adult MUST be in the pool with them. Our children are (unfortunately) under 140cm but they are all on the swim team, having years of (very expensive) swim lessons that they could probably save me from drowning in the ocean if they had to, yet because of their height, they cannot swim and play in the pools by themselves. After an hour of arguing that they cannot make us go into the pool with them, they have to be in our line of sight. The Sheraton has multiple small…",10
Very nice hotel but only one thing must be remembered and pay attention to  Check in time !  Either you go there to do the ore registration provided no need to queue. Then come back after 3 to collect your room key.   Otherwise you are expect to wait for hours to finish your check in procedure. I don't understand nowadays with the technology what Sheraton did not offer e check in service.  Since they are so popular otherwise it's not worth to pay over 1000 dollars for such short period of time.  Since check in time after 3. Mostly you will be able to get the room around 4 and check out time is 11am next day. The rest of the facilities are meeting the standard.,30
"Its not my 1st time i stayed in this hotel but the worst experience i have ever had. I booked the cotai view room and assigned to the normal deluxe room which was HKD500 difference on the room type. The check in staff was not helpful and especially when i asked if there any pamphlet for the restaurants provided that the sheraton is connected with other hotels as we want to stay in the block such that my colleague and i can work in the restaurant. He gave me a look and asked me to go to the concierge, so i did and got a quite not useful one as the map was for the Venetian chain.  After i got into my room, my blanket was dirty and i have to call the operator to send someone over to change it while i was out for dinner.  It was 12am when i back to my room and ready to bed, 2 rooms…",20
"i normally wouldn't write anything but i think it's useful for other parents to know about a few things.   My husband and I stayed in Sheraton Macau over the weekend and I felt the good comments i read previously was quite misleading. In conclusion, it's not a baby friendly hotel.   First of all, it takes forever to check in, we arrived at the hotel around 12 pm, they said the check in time is 2pm but my baby needs to take her nap soon, so i asked if they would allow me to check in first, and they said i could try at the SPG member check in counter, i waited in the line for half and hour and only to find out it's not possible until 2pm. so i had to come back at 2 and waited in the line for another 45 mins before we could get our key.. and baby has become over tired and cranky,…",20
"Check in at the club lounge was slow.  Might be understaffed.   However the staff was polite and courteous.  Our room was on a higher floor.  It was roomy and clean.  The reason I gave a 3-star rating was the poor design of the shower and the breakfast situation.  First, there was no shower mat (you have to ask housekeeping for one).  Otherwise it was very slippery.  No handle bar.  Also water ran outside the shower door because of the shallow ledge.  Secondly, there was not enough table for breakfast seating in the lounge.  We finally found a table but was next to the outside area where people went in and out causing a draft.   Food was ok.",30
"First, the good news: Most of staff we interacted with, with the exception of the grumpy, over-worked concierge lounge people, were friendly and responsive--within their province. The bad news, there weren't enough of them. The rooms were clean. The bathrooms very small.   But my biggest complaint was the price gouging. I attended a conference with a group rate and decided to stay on to enjoy a weekend in the city. I asked my daughter and friends to join me. In order to accommodate this, I needed to make a second reservation and decided to do so on the club floor. My friends booked the club floor themselves for the same weekend. Once I arrived at the hotel I decided the room I was given was adequate and asked to change the reservation, cancelling the second and extending my stay…",20
The slowest check in I have ever experienced. It was the long weekend in China so understandably busy but then the hotel did things like closing one of the pools which did not make sense. Pool ran out of towels no drinks etc.,20
"I was locked in the room on my first night there due to the faulty lock and my friend who came back to the room later was locked out. Took the maintenance/staff almost 40 minutes to dismantle the lock from outside. Staff at the reception didn't give priority to my call when I informed him that I was locked in my room. I had to call twice.  I was given a different room but no compensation whatsoever was offered to me until we asked. As a 5 star hotel, I believe they can do better.",30
Overall it's a good experience to stay in Sky Tower of Sheraton. Especially to dine in the Xin restaurant with very nice hospitality from Catalina. We did enjoy the food and to go twice within 2 days.,30
"Stayed here in May 2016 and arrived the hotel at around 13:30. My friend and I requested for early check in if possible. However, when I wanted to approached the reception, a man (looks like a security guard) told me check in counter has not opened and refused me for checking in (just directly turned me down). At that moment, I was very disappointed since no other guests over there and I wonder whether the staff there don't know how to do check in. Other hotels that I stayed before would allow me to do the registration and assist with luggage. Well... but no such service in Sheraton Macao. My friend and I needed to bring our luggage to the bell. (Not close to front desk)  Before arrival, I was quite happy with their staff since I sent them an email and ask for assistant for…",20
"To start off this hotel made a terrible impression when I had to cue up for 50 minutes to check in.    While this hotel has a rather large casino in the middle they fail to make space to accommodate their guest in their breakfast halls often seeing out their customer in 30 minute cues just to get seated in the breakfast buffet. Furthermore they fail to realise that many guests have cued up for much time and they very quickly start removing the breakfast buffet at 10:30 resulting in many not receiving the package they paid for.  Despite having such a great potential to be one of the best hotels in the area with spacious rooms and high quality of materials from the hair dryer which was greatly appreciated to offering free wifi hotspot throughout Macau and rather elegant hall,…",20
"About one to two weeks prior to our trip we requested to have 3 rooms that should be close to each other, but when we arrived we could only be arranged  with rooms about half a minute distance from each other. The worst thing appeared in the lift. They install a security system that requires the use of room card to get access to the floor we lived, but that system often malfunction. For quite a few times we could only take the lift back to G/F and scan the room card again. The elevator is really a mess.",30
"I'm used to better from Sheraton, this was a surprising disappointment. Try another NEWER Hotel I suggest, such as the Venetian or Parisian. I stayed in a Club Room on the 31st Floor of the Sheraton. The rooms are Nice and reasonable, however, an Older style. Pillows are those super soft falls away type, that you either love or hate. The Internet speed is good and free in the Club Rooms. The Room Service and the Food options are expensive and NOT the highest quality. The Minibar in the room is a bad joke, but it is Asia.The food in the Food Halls is just as good and  1/3 of the price, and a 10 Min walk. Try the food hall in the Parisian or Venetian. The pool area is nice, but most hotels have nice pool areas. The Club Room Lounge is a waste of time, the snacks at Lunch time are…",20
Sheraton Grand is just 10 minutes away from Macao Airport but is a typical massive casino style hotel where the lobby is like a busy shopping mall and it takes forever to find where your room is as the place is just too big. If you like massive casino style hotels this place is perfect. I dont.,30
This hotel is very good in terms of infrastructure and also the facilities but I was very disappointed in terms of service  I did share with the management and they promised to improve  Hope they do so  I normally have warm water with lemon and honey in the morning and they first say will try and then asked a exorbitant price for a this (which normally is free),30
"The hotel was defintely good for its value. The room was spacious. It was also generally clean. Check in was quick. The internet was quick. The view was ok. The guy from the philippine who was standing in the lobby was super helpful. I am sorry I forgot his name already but he was the best service staff so far I have encountered in Macau. However, most bell and concierge staffs were so rude and unwilling to help. The concierge were chatting among themselves while I went approach them to ask for questions and they made me feel like I was disturbing them and was not helpful at all. That's not the worst. The worst was the bell service. The staffs there did not speak English or Cantonese. They kept making me feel like I should speak Mandarin to them. And if I didn't understand, they…",30
"I've booked 4 rooms for my friends and I. It was a holiday so the 30 mins long queue was expected. However, the reception desk was very stupid and slow. It took us 15mins to complete everything.  At night we rang the room service and request for a dozen bottles of beer. it took quite a few minutes to be delivered. I rang the room service again and she said they were busy. Well, it was 2am...  The other day, 3 rooms were checking out and 1 room will be continue staying. I asked the reception desk lady if I have to pay for the drinks that we have ordered last night. she said the guest checking out will be paying so we sorted out the bills ourselves to the guest leaving the next day.   And the room didn't cleaned up properly. The left over of the beer bottles were still on the desk…",20
"My first stay at the Sheraton Cotai as a quick Birthday getaway weekend. Thought would give this a try as Sheraton is usually good for value!   Getting around is no problem, there are shuttle buses from almost anywhere to any given hotels in Macau. A taxi would be around MOP 50 to the airport or ferry terminal.  Reception  Unless you are an SPG member, do not stay here as it could be a good hour before you get checked in. As a member, I queued for around 20 minutes which has never happened at any Sheratons I've stayed.  Lobby It was a very busy lobby with all sorts from shopping, café, promotion, casino. This is something not preferred personally, as I expect some quiet moments but it is Macau so I should have expected it!  Room The hotel seems to have a few wings, and we were…",30
When we arrive we were led to a small check in area with three staff. All three staff had a guest but we were next in line. I swear 15 minutes later we were still waiting. I was so upset i was going to cut in and ask what they were talking about. Finally when our turn came I understood. The check in process was relatively slow anyway but then the receptionist went through a barrage of sales pitches. from flogging their loyaly card to wanting to provide late checkout on Sunday if we agreed to no room cleaning on the Saturday. really? I suggest Management review their check in procedure. Creating long queues of arriving guests is not a good start to the vacation.  Anyway that was the worst of our experience. The room was clean and large. We found the location very good. Very easy…,30
"The hotel complex itself is humongous! it is very impressive yes, but the attention to details get lost with a mega structure like this. I don't really have anything ""wrong"" to say, it is just too big and too ""mass produced"" Buy if you are into the gambling and shopping then the location is ok.",30
"Prior to 2016, Sheraton club lounge was one of the best in Asia.  It used to provide lots of selection of hot and cold dishes for breakfast and evening canapes.  They have revamped the club lounge by giving out noodle in soup and cold sandwiches.  In addition, they will hunt you down and charge for your children.  Pay a bit more and go to JW Marriott Hotel in Macau instead.",30
"On my  third stay in Macau I decided I would stay on the Cotai Strip for the first time. I have previously stayed in Macau (Grand Lapa and Grand Lisboa). So I discovered a problem with Cotai, there is no such thing as a 7/11 or supermarket anywhere in Cotai, so if you want a snack, or a drink you will be paying Hotel, restaurant or bar prices. In central Macau this is not a problem, as there are stores everywhere.  The other problem is it was raining non stop, could I find a reasonably priced umbrella anywhere in Cotai -no. This became a problem meaning I had to take the free buses between the casinos (even if they were just across the road.  I guess I can't blame the Sheraton for that, the hotel was everything I expected, room was large with full bath and shower, everything was…",30
"I would never choose any mega size hotel in the future unless there is a better solution for check-in. I moved to this hotel from another hotel on Cotai Strip around 12 pm, and hotel front office was very strict that check-in only starts from 1pm, so after I stored my luggage in concierge and came back around 3:30, I have to wait in line for 50 minutes to check in. The lines are just crazy as airport checkin counter, the craziest I have ever experienced. I understand such wait I s inevitable for a 4000 room hotel like this, but they could had been more flexible on taking check-in to reduce the waiting line.  Apart from this, I booked my room through Agoda and I was assigned to a room with poor amenities. There is no drinks in fridge, and the minibar is at economic hotel level.…",20
The check in and check out took forever. The lobby is too crowdede and most of the staffs do not speak english. The breakfast was great. Many food selection that we can enjoy and it very close with shopping center,30
"I always have a preference for SPG hotels when I travel. However, I stayed in Sheraton Macao for 1 night and it was highly unsatisfactory, and from now on I will always second guess myself when I book a SPG hotel.   First, the room was quite old, and although the room description said there would be refreshments provided - they were very minimal and highly unsatisfactory - there was nothing in the fridge and there were no snacks - only several tea bags and instant coffee were provided - this is definitely not up to standard of a luxury SPG brand hotel.  My most unsatisfactory part was that the next morning at around 10am, the next room was under renovation, and I have heard people drilling and banging the wall at 10am and I could not sleep at all. I really did not expect a…",10
"This hotel is a very ""cold"" hotel. Check-in process takes forever and staffs are pretty ""plastic"" and have no sincerity in helping you out. I have no complaints about the hardware of this hotel BUT the software of this hotel is absolutely disappointing. Location wise, it is definitely in one of the best areas in Taipa and there are plenty of shopping and F&B outlets around this place. I am disappointed that this property is nowhere near the high standards that Sheraton Hotel group has set. Massive rooms for improvement.",30
"The hotel has got a great location; attached to the huge Sands Cotai Central mall, a walking distance to the Venetian, Parisian and Studio City. However, the quality of service crushed my holiday experience. I am an SPG member and there is a special place to check-in for the SPG members. The receptionist did not greet me, not welcoming and not smiling; might as well check-in online; I felt like talking to a robot. The room is quite spacious with a nice pool view, but there was a weird smell in the room. The only decent experience I had was during my workout in the gym. The gym staffs greeted and smiled.",30
"Experienced the longest ever hotel check-in ever, took almost an hour and the front desk was pack of people. Never had this experience before where the front desk was so full of people waiting and sitting on the floor in a 5-star hotel.  But once you got over the check-in, the stay was decent. The room was clean, comfortable and rather big. The gym was spacious with enough machines to satisfy most gym junkies.  A good stay if it wasn’t for the long check-in. One of the cheaper 5-star hotel in Macau and in a good location.",30
"This is the second time for me in this hotel in the last one year and have experienced just the same issues as i had in my previous stay. Let's start with the positives - big rooms and nice ambience and unfortunately my list of positive stops there. Having worked for this brand in the beginning of my career, I find it very hard to believe the bad attitude of the staff at reception desk and the restaurants. They made us feel that the only thing they bare interested in money, not the service they should give us. We don't get water served till we order something. We don't get the rooms till we pay a deposit for other services even though the rooms are paid fully in advance, doesn't matter if you have travelled for 24hrs and you reach at midnight, they won't give you the room till…",10
"Although it is a 5-star establishment, it really depends on which wing you are staying at. We opted for a non-smoking room and were given a 16th floor room on Earth Tower. My friends wanted a high floor room and were given a 26th floor room at the same Tower. Another couple on the other hand were shown the Sky Tower which had access to the Business Lounge. We were all on a leisure trip and had booked deluxe rooms!  The Sheraton is massive, and linked via indoor walkways to the other two hotels - the Conrad and Holiday Inn. At the Sheraton, if you are an spg cardholder, you are entitled to attend the Cardholders Casino or receive 20% discounts at its dining establishments and restaurants.  The room is spacious and comfortable - especially the bed and pillows. The bathroom is…",30
Pros: Hotel is wonderful.Rooms are convenient and breakfast is lavish. The location is perfect . Cons: Front Desk staff  Their attitude is completely unacceptable. They are unable to communicate properly in english . I asked them for their manager and the staff bluntly replies that the manager sits behind in the back office without lifting his head. Their policy of 5000 HKD as deposit is from the 17th century . There is however a better way of enforcing this than allow their untrained front desk staff communicate. Somebody needs to drive the fact to their front desk staff that hospitality is all about being pleasant and warm especially when we arrive after a long humid day. Never would i visit this hotel again nor recommend it to anybody,10
"Very low quality hotel for a Sheraton brand. For few MOP more you can stay in other much better and newer hotel. This is old most foreigners don't choose this hotel anymore. Room facility is not good, very low quality products on the bathroom. Towels are small and hard. Minibar was EMPTY. They put a notice to call the room service in case you want to fill the mini bar. This is not acceptable for this hotel standard. Breakfast was poor at most. And if you pay apart, it cost you U$ 23 per person.  Don't recommend at all.",20
"We paid for a room with view and the view we got was another building right next to us. Although, the bathroom is big but we are not sure about the cleanliness because we found hairs in the baht tub and pieces of snacks on the floor for over 3 days! There was nothing in the refrigerator.   However! Great in room dining services!",20
"Background: We are regular patrons of spa getaway overnight stays in Macau. As my wife and I are based in Hong Kong and 10 minutes away from the pier, we nip over for some pampering whenever the mood calls for.  Usual stays: Four Seasons, Mandarin Oriental, Banyan Tree and Ritz Carlton.   For this trip I thought to try the Sheraton Grand for my wife's birthday getaway as I had never been before.  Big mistake.    What could’ve been quite a good experience was tarnished by hotel staff who were uninterested in providing hotel service.   I booked the Deluxe Suite (1,345sq ft) directly via the Sheraton website so note that my booking was not one of those ‘cheapest deals’ on the net or via any third party website.  · Decent hardware, our suite was very nice. The layout of the suite…",10
Pretty much like Venetian and cheaper  Downstairs mall is the same  They are all interconnected through pedestrian basement or overbrige They jointly have super connected malls and their own casino So I would prefer Sheraton over Venetian cuz it's cheap and the same   ,30
Hotel is located in a very good location for shopping as it is only 10 minute walks to Venetian. Free shuttle bus available to Galaxy area. Concierge team are nice and very helpful. Room is quite small and look a bit old. The rest was just ok for my stay.,30
"We stayed in the Deluxe suite, it was clean and big. Personally if travelling to Macau again I would look for cheaper options because not sure it's value for the expense, the lobby was v crowded and the hotel lacked a personal touch. Also having booked the room for two people with breakfast I was a bit surprised that the breakfast was for only one and I had to supplement the extra cost.  Location was good though.",30
"I chose the SGM for its pool area, and was assigned a room in the Sky Tower. Found the rooms to be smaller than comparatives, clean but my room had a musty smell.  Our water was shut off without notice one morning for about 30 minutes, with one of us amidst a shower.  Not cool! Will likely stay in the Venetian next time around.",30
We stayed overnight and it wasn't really our scene. Massive casino / conference type accommodation. Asked to come back to check in 3 times (and SPG members) because it was fully booked. Good average. Room was grand. That's about it. I'd probably stick to day trip to Macau unless you enjoy casinos...meters away from reception check in.,30
"We checked-in on April 16th at 4pm,  I was so shocked to see the queue was tremendous long.  It finally took me ONE hour to check in.  It was no fun at all as I was bringing along with 2.5 yr old boy and he has to running around and my husband need to keep an eye on him. I have no choice need to remain on the spiral long queue myself!  As a brand hotel, I felt so disappointed on the holiday arrangement as simple as just for check-in & manpower! I have been told most rooms are still waiting to be cleaned & tidy up!  Room is clean and spacious, the bed is big and comfort. My kid loves the pool.  However, there're numbers of sharp edges inside the room which parents might need to keep an eye on little ones while they're playing and wondering around.  I would say it's a hotel good…",30
"I have stayed at 17th floor at Skytower on 16 April 2017, around 4 to 5 rooms are under renovation, one of these room is next to my room, it's so noisy and dirty in this floor, dust is full of my room door.  My daughter can't sleep in the room.    There's a woman called me and said that she's the Manager and understood about the noise of 17/F., she said it's just a regular check, no maintenance work.  I told her it is a maintenance, the brick was broke on the floor and dust is full of the corridor.    Her attitude shown that she is not care about the guest comment/complain.  I told it's not about noise, it's about safety and cleanliness, it is because after I back from swimming pool, several workers are in the corridor and they have come to my room mistakenly.  As there were…",20
Good value when booking from India. This is the most basic Sheraton I've ever stayed in. But in Macau you spend less time in the room and more out in the casinos or shopping. The rooms have everything you need. Wi-fi isn't great but the handy phone is very useful. Coverage inside rooms is poor. I stayed on floor 30 in Earth 2 tower. Some rooms have bathtubs and some only showers. If a tub is required please do ask specifically.   Located opposite the Venetian and adjacent to the Conrad and St Regis. There's is nice shopping mall on the ground floor. Also shuttles to Macau pier are available from the East Lobby. A small walk away is where shuttles to the old Portugese town start from.,30
"Sad that I started to write this review in total darkness... We booked 3 nights & 4 days, the first two nights in a suite & the last night in a smaller deluxe room because my mother was staying with us on the 1st two nights before flying back to Canada. On our first night, we found one of the main ceiling lights couldn't turn off in the room so my mum had to sleep with it on. On the second evening we called the technician who said it would only take a few minutes to get the lights fixed. So we waited.  Here comes the nightmare... suddenly all the electricity in the room went off. No aircon, no tv. No internet. And, of course, no lights whatsoever... My 2 kids started screaming in the room and my husband was sitting in the toilet not knowing what happened! The tech. guy called…",20
