Content,Rating
"This review is really for travelers with families/ small children. Rest of the stay was standards standard room, standard buffet, standard amenities.  We went for 2 nights 3 days with our daughter, and stayed in a deluxe room. Overall, we felt uncomfortable with the facilities and standards for safety for children. Now for specifics:  Travel to the hotel - We got into the shuttle alright, but when we reached the hotel there was no one to watch over buses coming and going. The driver simply stopped and opened the luggage carriage as asked us to exit quickly since he had to leave immediately. So I climbed in (cause our luggage was at the back) while my 2 year old daughter stood IN THE MIDDLE of the road, because she wouldn't stay on the side alone with dozens of guests trying to…",20
"As a fairly regular Macau visitor, I decided to stay on the Strip for a change, as I was travelling with a group of friends. It's fair to say that we were not the target demographic of the hotel, but the pool shut at 6pm, and there was no bar apart from a weird lobby cafe. Good food options were also very limited: fortunately, we know Fernando's! A strange hotel. Back to the Westin or one of the other Strip hotels next time. For the biggest Sheraton in the world (and presumably their flagship hotel), this place needs some work, as do the staff who were unable to comply with a simple request to leave a couple of water bottles outside the room, so as not to wake my friend up. Come on, Sheraton, you can do better than this!",30
"In this trip, we spend one night to live in Hotel Okura Macau and one night in Sheraton. If you think the Starwood association which provides SPG (Starwood Preferred Guest) always has great  and amazing hotel, you might disappoint on the Sheraton in Macau. We spend about 250 USD( in the weekend of the holiday) for one night and I think it was not worthy. The lobby smells of smoke (maybe the Casino is next to the lobby, the smoke might come from there). The room is just a normal size and it provides not enough towels and base rope. I think I'll spend more 100 USD to live in Hotel Okura Macau again, because the room size of Okura is triple size than Sheraton and everything in Hotel Okura Macau is better than Sheraton. You only need to spend about 100 USD and you will feel…",20
"This is world's largest Sheraton Hotel located in Macau Cotai area.  There are two reception area and SPG reception area on 4th floor. Try to avoid the reception area in front ot MacDonald which is rude and lack of SPG knowledge.  For SPG members, room upgrades are not given unless you strongly asked for it.. We booked suite room which is large and luxury with standard above typical Sheraton room.  Service level within the hotel is good except for those in reception area.   If you are looking for better service, go to Conrad Hotel.",30
"1 / The lobby having long queue and need me to wait at least 15 minutes.  The hotel have a lots of counters but no good signage or direction system just guiding by the staffs (seems higher level), specially I noticed a male who is short fat guy is the guiding staff, but he was talking with the mobile phones, then walking around and just walk away to the back office in sudden.  Why he came to guide us and ran away if he is too busy?  That is not a good service which Sheraton should be  2 / there have a lot of lanes, but the mainland Chinese always jumping the queue or just go directly to the counters from the exit area, but no security guards force them to lane back.  So, what is the meaning that I wait so long for lining up?  3 / The front desk staff assist me to do the check…",10
"Now we all know that Macau/HK people are comparatively rude compared to the rest of the world but I would never expect that the staff in a 5-star hotel are the same. I am talking about the staff stationed at the entrance to the lifts (those who check your hotel key-cards).  The manner in which they spoke to you made it seem like you were passing through a security check-point (gave off a vibe that made you feel as if you were someone trying to sneak through the security into a hotel that you could not afford). To top it all off, no smiles, no 'good mornings, good evenings'. Heck, even staff in budget hotels know very well that those are the basics in the hospitality industry.  While I have no problems with the rest of the hotel, this one blemish is enough to warrant an 'average…",30
"We made a spontaneous visit from Hong Kong during the Buddhist's Birthday holiday. This was our 3rd time staying in this Sheraton but we left with great disappointment.  Upon arrival, we noticed that the priority check in area for SPG members are already closed, so we had to queue up for quite a while at the reception. The staff was pretty slow and their English level was far from the proper standard. As a loyal member, we didn't feel welcome at all as there were no special greetings and offer etc. The staff started asking us questions like one bed or two beds, smoking or non smoking, higher or lower floor - I told him I already listed all my requests in my booking and it was shown in my member profile. This is ridiculous!  Then my issue with them was - since I made the booking…",20
"We stayed at this hotel for 2 nights in mid-April.  First impression, it looked pretty good however that quickly deteriorated by the time we got to the desk.  I understand that I am in China - not back here in the US but the communication issue is so frustrating.  For a brand that I believe (pls correct me if I'm wrong) is based in the US, I would expect at least one person in the desk all the time that speaks fluent English. (This was an issue with the rest of our stay here). The next day - we had better luck asking for directions from the concierge  on one of the other hotels (Holiday Inn?) that is adjoined with this one.  The accomodations were pretty good.  Comfortable beds, great view of the city, nice bathroom.  At least we enjoyed the buffet breakfast, just do sign…",30
"I will start my review arriving in Macau, wow that was an experience ! Immigration was so slack that I still have my embankment card in my wallet as no one collected it or checked as we came through from Australia! We were confused as signage was poor or in Chinese which we can't read as to where to get our bags, could not find anyone who spoke enough English to help. Finally got our bags and went to find the shuttle to the Sheraton . Again we had no idea as other hotels had people with signs at the airport but not Sheraton. It was actually a tour guide from Whyn hotel who showed us how to get to the shuttle. Once there we had the rudest and most unhelpful driver I have ever come across who just pointed and grunted at us. We arrived at reception and got checked in and shown to…",30
"I am a SPG PLATINUM member and used to love staying at the Sheraton group of hotels around the world..  I have had long stays at stays at Sheraton Hong Kong,  sometimes up to almost a year at a stretch. I used to greatly enjoy the hospitality and efficiency of the staff and the quality of the rooms and other services.   So it was a shocking experience in Macau Sheraton. Though the staff try their best to look courteous and attentive, there seems an air of utter chaos every where.   The moment you enter the main lobby, you are lost in the sea of people and the chatter and clatter reminds you of some over crowded flea market. Chaos seems to prevail everywhere and in everything you want to do.  I  Maybe it's because of the large number Chinese mainland tourists??  No I don't think…",20
"Had stayed in the sky tower on its opening and now am in the Earth tower . Service is deteriorating - no welcome drink but luckily the check in reception service is good. Upon entering room, no room slippers, one table lamp and two ceiling light bulbs blown, no bar soap. Nice coffee provided but no fresh milk capsule - only creamer which really spoilt the drink. This should not be a 5 star standard. Leave message on table on above so that housekeeping can do the needful but too bad the staff cannot read English and message was left unattended. Also after cleaning room no bath mat and no refill for shower gel. Need to call and request staff to bring. Typically there is no supervision to ensure everything is properly in place. This is really shameful!",30
"I was told that this is Sheraton biggest hotel property in the world with 6000+ rooms! This place is huge but soulless. I don't feel like a hotel guest but a shopper in a huge shopping mall with casino. The room is spacious but of standard design. I hardly get to interact with hotel staff at main lobby and concierge because they are located so far from my Sky Tower room. Due to too many hotel guests, one can do an express check out by dropping the room card into a box at lift lobby. As a result, hardly any chance for human interaction. As a SPG, the hotel offers a room wifi service at MOP 30. I won't recommend purchasing any wifi service because the connection kept dropping and the speed, well... there was hardy any speed I guess... Compared to Galaxy Hotel, free shuttle bus…",30
"This is not a good choice for the travelers who seek the experience of visiting Macau's historical heritage sites. However, it is a good place for those who enjoy casino, high end shopping and entertainment shows. Children will not enjoy this place.",30
"We went for an overnight stay in Sheraton. We chose this over the others because they seemed to be the most child friendly on paper. Turns out it was worse than picking a hostel. W arrived by ferry from Hong Kong and upon arrival, I immediately went to the information desk and asked where the hotel bus transfer was and was told to cross the underpass and find them there. While the other hotels had clearly marked buses, Sheraton had a print out of their logo on a piece of paper mounted under the steering wheel. Suffice to say it took us some time to find that one bus among the dozens randomly parked. Then when we did find the us, the attendants couldn't care less that I was carrying my 4 year old with our backpack and pulling 2 strollers with one hand. Awesome... they didn't even…",10
"We visit this hotel again since last July and realized services continue to be poor and no improvement has been in place at all! We moved to Sheraton after spending a night in Grand Hyatt. Nothing to be compared as it is a 2-star versus 5-star.   We were diverted to another side of the lobby for checking in without realizing we were club patrons and ended up waited 10 meaningless minutes before heading to club lounge check in. Nobody acknowledged us while sitting down at the club lounge, not a smile and of course none service at all. Unclear message was given upon check in and we eventually went to the wrong side of the hotel and tried opening a wrong door. Housekeeping girl provided nil service and only told us about the wrong direction and we have to deal with this through…",20
"We were awaken in the morning (that too after a late night sleep) by continuous attempt of opening our door even when the DO NOT DISTURB was turned on (we guess they could not ring the bell as DND was on). We were too annoyed by the noise and opened the door to find out some random guests thought that it was their room. Mistakes happen, so no big deal. However, what we could not believe is that they were accompanied by a hotel staff who took them to our room not realising their room was in other tower. Not only the staff did not check their room number but also he did not respect any value for our privacy (neither the red light for DND on our door bell). How pity!",10
My girlfriend and I stayed here for our one night in Macao to experience the casino atmosphere.  Unbeknown to us this hotel is combined with several others all under one roof and is linked to The Venetian across the road via a flyover walkway. The hotel is designed so that you never need to leave the complex which is fine but not what we were looking for. The gambling arena and shopping facilities at The Venetian are pretty good but I felt that we were on the outskirts of the action. We got a cab to the MGM grand at night and visited The Wynn and The Grand Lisboa. This seemed much more central and where the action was at.  Notwithstanding the above the rooms were very nice and the hotel itself fine enough with plenty of good eateries to choose from. There was also a free shuttle…,30
"We ordered and extra bed and blankets for our room. Someone came in 20 minutes and brought the blankets but no bed. When we called the front desk and asked where the bed was they said we first needed to pay at the front desk. They could not just charge the room. When we wanted to use the internet...same story, come to the front desk and pay for it first. When we wanted to have a coke from the mini bar it was locked. Guess what they said?? Come to the front desk first to pay for it first. All the food was high priced Asian crap except for Bene. The problem with Bene was the hair I found. ",10
"To start with: while the rooms are nice, the location is just wrong. Construction sides all around, and a rather poor casino in the complex. Rather recommend to stay in Galaxy (much nicer inside) or better stay on Macau side which is more authentic and less clinical. If you go for Sheraton, upgrade to a lounge room, the premium is worth it. ",30
"Whereas the room itself was fairly modern and tidy, got few points to note -  1) There are areas in the pool side which are full of exhaust gas smell from the adjacent kitchen(?), which brings cooked burned oil smell in the pool area. Fairly unpleasant - we ended up changing our seats twice before found a spot where there is no ventilation noise or smell. Just poor design really.  2) It was a slow service to order food to pool area, drinks took borderline 15minutes and pool snacks about 40 minutes. Suggest bring your own drinks & snacks.. easier. There's a McDonalds nearby :)  3) Wi-Fi connection non-existent to poor - tried and tested in the room and also on the pool side. Perhaps cable connection is better (provided in the room too).  4) Overflow of rubbish along the hotel…",20
I have been to Macao for business conference and got a chance to stay in Shreaton Cotai Central. Checkin formality was managed by our company event management team hence that was okay.  Pro: Rooms are good with all the basic facility provided within the room. / Size of the room is also big enough good space. / Bathroom is also very big and good. Cons: Staff is not well aware on the English. / Almost no option for Vegi like me. / Very difficult to get in to room being a very big hotel and confusing ways. Do think twice before visiting with family. be ready to walk a lot within the hotel itself.   Overall its a mix experience to me. did not find cool feeling.,30
"With the Sheraton name you expect a little more from a Casino resort. As soon as you walk in the hotel is confusing. The SPG check in area has no ramp access from the front so if you have alot of luggage that's going to be an inconvenience. The woman at the check in counter lost our initial reservation and tried to make up for it by offering free wifi. In reality my entire hotel floor has free wifi. Laptop connection is just fine however, it will kick you off after 5 min for inactivity on a wireless device fyi. I would have rather paid for  my own access to avoid this. Felt like a cheap ploy from the receptionist to offer free wifi when in reality it's free. Rooms are nice and the pool is great. I've only eaten the buffet breakfast so far and it was pretty good. Just plan to…",30
"This isn't so much about the hotel as the area in general. Our tour company booked us into what is billed as ""the biggest Sheraton in the world"" with something like 3,880 rooms (yep). The hotel is spic-and-span new but its hugeness is overwhelming. A one-night stay saw a lot of time spent trying to find the right lobby (several of them) and the right bank of elevators. Our room was utilitarian compared to other five-star hotels. The breakfast buffet (included) was the best feature, we felt. This Sheraton is located on Cotai Island, a section of Macao under international mega-development as a clone of Las Vegas, lots of construction going on, themed ""City of Dreams."" Right: it's far from the historic centre of a very interesting city, with no local neighbourhoods to explore, or…",30
"I booked a Suite at the Sheraton for 2 nights to celebrate my fiancee's birthday from 24-26 March.This is my first time staying at the Sheraton property, however, it didn't leave me with a good impression.  My fiancee's birthday was on 24 March which I had already informed the hotel prior our arrival, the staff who checked us in was nice and friendly, but there might be some system error, the registration card was showing the wrong departure date, but problem had been fixed quickly, then we go to the elevator with our suitcase with NO ASSISTANCE.Room in the Sky Tower on the 33th floor was assigned to us, the room was nice, clean, simple but absolutely comfortable. However, when we just settled ourselves, there were some noises coming from the top (Drilling walls &…",30
"This is the third time i stay in this hotel. The room is still very good, spacious and  make me feel relaxed and comfortable. However two of my friends room card didn't work when we come back to the room after having our breakfast downstairs. We called to the front desk for help and we wait for the staff for 15 mins to open our room which had not been check out. This is our first time we experienced this bad situation in any hotel we visited.  Please ensure your room card system stable, not to bother your customers like that.  One of the staff in the express check out counter is not very helpful, i forget her name,  but her attitude is really bad, make me a bit angry. this kind of staff cannot be found in any service industry.",30
"I really like this hotel. I have stayed here many times since opening.  Great gym, very nice pool's  Good spa Facilities  But the room service choice is very limited especially in relation to western choices and quality  Simple things like no club sandwich or standard hotel room service things like steak or chicken Been like this for over a year and always frustrates me when I visit  Also currently some construction taking place on the higher floors",30
"Very easy to get to the Hotel from the Airport, 5 mins maximum, but then the fun starts.  The check in desks (there are many) are accessed by a immigration style line queue, and all though they had about 8 desks open, it still takes an age to get to the desk.  Finally I make it, find out Im in the Earth tower, 21st floor.  You make your own way to the elevators, nobody carries your bag or guides you in the right direction and it would be quite easy to get lost, this place is massive.  Up to the room, very impressed, nice layout excellent bed, nice and quiet, all good so far.    Return to my room after a walkabout, according to the TV i have a voicemail and written messages, I go over to the phone and desperately search for the voicemail button, there isn't one, ring guest…",10
"This was our first overnight trip to Macau to attend the Rolling Stones concert.  We chose the Sheraton because it was so close to the concert venue and due to availability, quality and price.  This is apparently the largest Sheraton in the world and it showed in terms of the huge numbers of people in and around the hotel.  We took the shuttle bus from the Macau Ferry Terminal and were very impressed with how easy it was to get to the hotel and check in.  I'd booked through an online site and on arrival was informed that neither breakfast or WiFi was included in the booking, but that I could add this for a cost as an SPG member, which I did.  The place is HUGE, but the room we were given was very nice.  The hotel itself is part of a huge shopping complex that attaches 4-5 hotels…",30
"I have stayed in many new hotels in Macau and Sheraton Macao is probably the worst I have ever stayed.  Inattentive Staff I booked the hotel room and transportation through the travel agent in one go to save time and effort.  As I wanted to request for a non-smoking room with king-size bed, I wrote an email directly to Sheraton Macao.  In the email, I clearly informed the officer that I have already booked a room (with my personal particulars and date of stay) and would like to add a remark to my booking.  Sadly, the officer handled my email unconcernedly and gave me a room quotation instead.  I have never expected such heedless working attitude or poor language proficiency from Sheraton Staff.  New but not worth I regretted choosing Sheraton Macao instead of other big brand…",20
"The breakfast is unpleasant, the place is heaving with people, Palms the bar/coffee shop next to reception is an exercise in patience. Outside of the room this is a tiresome experience as is much of Macau these days. The staff are very pleasant though. Will not be returning.",20
"Stayed in the Deluxe room for 1 night last week. Luckily only 1 night in this hotel. The hotel is pretty new, however it feels more like a 4 star hotel rather than 5 star. The facilities and hardware are still in good conditions. Personally,, i don't like the pillows which are too soft.  Since it has a lot of rooms, so the lobby is very busy without any 5 star hotel touch. The sound proof of the room is terrible. It was a family staying next to my room, and i think the 2 kids were very excited with their holiday.  We could hear very clearly when they were playing at the door area and running along the hallway happily. I was waken up by them at 7am++. If you are a light sleeper, may consider request for a quiet room. Another incident happened during our checked in, there was a…",30
"I took the offer of Sands to enjoya cheaper rate of this hotel but I never expected the service quality would follow the price.   But with same charge, I could  book Ponte 16 through a travel agent and enjoyed much better service quality of Ponte 16  although the casino there is much smaller in size, but within 15 mintues walk, I could go to other casinos.    Previously, I could check in and get the room before 12 noon.  This time, even I offered to complete the check in procedure and got the door key after 1 p.m., I was still rejected.  Only few guests at the two front desk zones at that time.   Being a SPG member, without the membership card, for the first time, I was refused to the membership zone for checking in.  I had to go to the other check in zone to verify my identity…",10
"Within two hours of arriving at this hotel,I could tell you more than five things wrong with it. (1)asked to change room, none was available.(2)not all elevators goes to all floors, confusing.(3)can't charge restaurant bill to room,system down(4)largest hotel, by who's standards.(5)who in their right mind would design rooms facing each other, so your view is the room in the other tower. Sheraton, what a wasted investment,five star hotel, maybe,but definitely one star experience!",10
"One of the the worst hotel I ever stayed.  1. You checked in, follow the sign to the lift, reached your floor, and guess what, you can not find your room. Your room number was not in this floor. Then you called hotel, then they told you that your room number is in ANOTHER building. What ? Why not tell me when I checked in ? Their answer, 'sorry, we forgot'...  2. OK, then you have to drag your luggage and go to another building. Finally found your room, open the door. You got confused again. You asked for a NON-Smoking room. But the one you got is obviously heavily SMOKING room. You called and they said, 'sorry...' again.  3.  Fine, maybe just open the window to get some fresh air. Then you wanted to check your email. But found out your could not connect into internet. Call IT,…",10
"I went there with family on 1 Feb and stayed there for 2 nights.  The room was OK, but not as good as I expected.  The bedding and pillow is good.  But the housekeeping is not. After we came back from the sightseeing in the afternoon on the second day, we found the hair dryer was not put back at where it was.  The robe was put where my husband left that morning, which was on the chair.  The worse part was the housekeeping did not clean the coffee maker.  We needed to clean it by ourselves.",30
"This hotel has not met my expectations during my stay already:  - no upgrade for SPG Gold member  - late checkout to 4PM was given, but extension of late checkout from 4PM to 6PM was denied  - coffee press not cleaned and kettle not put away during room servicing  - request for a power adapter for my US three-plugged laptop was not available ('we don't support that"")   But the biggest disappointment was in the checkout.  I had to make some calls to Cathay Pacific Marco Polo Club for a booking. Unfortunately, Marco Polo made it very difficult to call in - the call gets connected but then drops into voicemail.  But Marco Polo has a toll-free number in Macau Local calls in Macau are *free*. Of course, there is a fixed monthly connection charge. Just like HK - so rather than use my…",20
