Content,Rating
"Room is big, with a large bathroom with shower and bath tub separated. The bathroom amenities like shower gel and shampoo are poor in quality. I have uploaded the TV channel list and laundry price list.   The router in the room provides both wired and wifi connection. Two power outlets at the table and one at bedside",30
"All the filipino staves and security personnel from the hotel and in casino are all acting bossy and disrespectful. They are like waiting for a tip, and if you don’t give a tip, they will snob and make face plus laugh behind your back. They are making fun of the guests. Seems like they’re not seriously doing their job. They should be fired and replaced by more competent people. They act bossy like they want the guests to adjust for them, really.",10
"Would not suggest staying here at all. The rooms are below par, the service is missing and there is very little ambience or atmosphere. It is lacking in every element that a Sheraton Grand should portray. Sadly can not recommend this place. ",10
"Upon booking, I ordered a non-smoking room, but I was welcomed by a strong smell of cigarette when entering the room. We called Room Service, and the staff was indeed very sorry and willing to help. The agent told me that a staff member would bring the keys to the room in a few minutes.  Behold, that's when the drama starts.  It was 11.45 pm when we called room service (it was indeed late by normal standards, however, in Macau, the service was still at full scale, even in late night). We waited for an hour, an whole hour without any staff appearance. We called again. The staff remained very polite and was very sorry for the delay, which was appreciated. However,  the staff member did not appear in half an hour. This was already around 1.20 am.  The staff did not brought us the…",10
"Very basic stay in Macau, and as a Titanium Elite Member, I expected more than a plate of fruits in my very basic, old feeling room, which deserves some remodeling.  Unfortunately, I wasn’t upgraded to a suite as expected whenever there’s one available (and there was). That would have made a big difference.  In fact, the only good thing about my stay was Ms. Carmela at the Club Lounge, who’s a true professional and the sweetest person. Thank you. ",20
"I received an email stating I can check in at Marriott Bonvoy counter but when I wanted to step onto the steps, I was blocked by a Marriott lady staff who was very unfriendly and rude requesting me to show the print out indicating I am a Marriott member.  I told her that I am a gold member but I didnt print out the check in email or downloads the apps.  However, I asked her to let me in to sit on the sofa first and show her my passport.  She used her  body to block me to go in, I felt so insulted. My husband just came in and gave her my passport, then she passed the passport to let the reception staff to check.  After checking, our booking was there.  The lady did not apologize for her rudeness but just walked away.",30
"Arrive hotel at 5pm and the queue isn't very long, but the ground staff took me to 4/F club lounge but it takes around 5 mins up and down, once we get out from the lift, original I am at 2nd, other guests jump in front of me and make me into fifth...so sad, the staff should arrange it...In fact, I don't feel it is faster with only 2 staffs there and feel inexperience.  Finally, I can check in and the lady told me they only have double room, but what I booked is a twin room, also she said all non smoking rooms are unavailable or still tidy up, OMG...is 5pm, I suppose everything are ready...what's a poor front desk service I never have in Sheraton group. At the end, I can get a room I booked, but it's a bit non professional the lady process my booking with talking her mobile with…",20
"I was stayed at here on 21/12 until 23/12.I booked a Deluxe twin room(2547,Earth Tower) through Agoda.The hotel is crowded because there are so many people.But the check in queue is very2 long.Great service by concierge.Room in Earth Tower was outdated,Sky Tower could be their newer tower.Room are fairly clean but little old.Cannot control the speed of shower in the bathroom.They also have free shuttle buses to airport and ferry terminal.Lastly,NEED TO IMPROVE MORE ON CLEANINESS IN THE CASINO TOILET.The casino toilet was very2 dirty.",30
"It's fine if you like gambling, I guess. And shopping though the prices are twice as high for brand names than anywhere else. The rooms are large and comfortable> the rest of the hotel is like being on a crowded city street. No quiet lounge or coffee shop or bar. They were waxing the floor in the lobby at 1 am when people are still out and about and the one coffee shop bar in the middle of the crowded lobby was already closed. I guess the only thing left to do is gamble.",30
Stayed at Sheraton this November. Room condition was poor. Middle of the night room heater stopped working. I had to change room with small kid. Even after talking to the manager I was not compensated for the trouble ,10
"As an Elite Bonvoy member I was really hoping to leave a more positive review. Our trip was mixed, at best.   The rooms are quite nice and comfortable, although the hotel itself is very disjointed. Service is far off what a normal Macau experience is.   Our check-in was very unpleasant. We were invited as Bonvoy members to check in online prior to arriving. Don’t bother... you need to go through the entire check in process all over again when you arrive.... Check in took a long time, as our attendant was working through the system. The staff are quite pleasant and do try their best to deliver good service, but the system and the poor Organisation of the hotel work against their efforts. The lobby and elevators all smell of cigarette smoke...  The only positives were that our…",30
"Booked a double room thru agent but hotel said no record.  After discussion, hotel offered smoking room with double bed. No choice but to tolerate light smoke smell.  Normal facilities and good size of room. Avoid 2~3 pm n 5~6 pm for check in or out as many tours wld arrive n created long waiting time.  Drop keycard at express check out stand to avoid long queue.  Easy to travel by hotel coach which are new n clean.",30
Sheena has been very entertaining. She take us out from a very long check in line thats why we managed our trip very well having a very fast check in. She also introduce the facilities that makes us feel welcome 😊,30
"Unacceptable service.  I was disappointed by this hotel because I checked out at 7:30am. Obviously I left my glasses already and no one from hotel gave me one single call for the whole day. I had my conference in this hotel conference room till 4pm. Within all these 8 hours, no one called me. Not a single call. And if any of their staff had tried to call me, I might not need to go through all these email sending, phone call waiting.   I discovered I left my glasses when I arrived Hong Kong home. My friends will check out tomorrow so I asked them to call the reception to see if they found any glasses. The receptionist replied them immediately saying no lost items was found. So I called the reception myself at 8:30pm, they said they would check for me, and they called back saying…",10
"Bit hard to find entrance to main lobby. Main lobby looks promising and that’s all. Check in took a while due to scanner issue. Room at “Earth Tower” was outdated, Sky Tower could be their newer tower. Lamp was flickering. Receptionist doesn’t have information about shuttle bus to Cotai Ferry Terminal readily available. When asked, he told us that the swimming pools are all closed until March. I could not find these information on their website. Not recommended.",30
"The hotel room rate is cheaper than the rest adjacent Marriott brand hotels.  As a platinum member, I didn’t get any upgrade, not even a better view room.  It was a slow weekday, the hotel was not sold out.  I checked in the hotel by Marriott mobile few days ago and it didn’t seem anything happen.  I asked if there was any upgrade during in person check in, the check in person immediately told me no without even looking the computer.  When we got to the room, I saw a maid was cleaning the adjacent room.  I asked her if we can get extra large towel, she immediately told me no.  She said she only had enough towels for the room she was cleaning.  We did get the free breakfast as the platinum benefit on the first floor restaurant.  I was surprised the servants couldn’t  speak…",30
"Was very disappointed with Sheraton service .I am Celiac and forget about any food for gluten intolerance or if u vegan it's not a place to be .service is slow .Staff can't speak English .There is long wait for food ,etc . Would expect much more from Sheraton",20
"I stay at the hotel for a company function, the food quality wasn't that good, the service... Well, there is no service especially your claim yourself 5* hotel at the formal dinner, the staff doesn't even know what is red, white glasses, yes, it was that bad, no training at all, just randomly find someone who is available for part-time work. ",30
"Spent two nights in this hotel with my wife to celebrate our wedding anniversary. Booked their suite  which the room is quite nice, clean and very spacious. However, the room is full of cigar smell and we thought the smell will gone after some time, but when we get back at night time,  the smell is still there and we are too sleepy to ask for another room, so we spent our first night sleeping in an ashtray.  First day breakfast is very disappointed as we were asked to have our breakfast at their ballroom which everything was set up temporary, some of their hot dishes are cold. So we request to have the breakfast at the cafe in the next morning but not at the ballroom. At first the staff said the cafe is almost full and suggested we go to the ballroom again, but we insist to go…",20
"Even as a premium member it took us ages to check in. 4 bottle white wine list with only 2 available (and as you would expect the two I didn’t like!). Corridors and room smell of stale food and the air-con didn’t work. People who visit here like to cook their own food in the rooms.   They did send people up to try and fix it, but frankly it shouldn’t happen in the first place. (Photo of chap deodorising)  Just generally a typical Cotai casino hotel experience - very average and best to be avoided. In fact, avoid Macau hotels in general!  I don’t apply this to Marriott/Bonvoy in general - I’m a fan - but just this (and most) Macau hotels! Stay in HK and travel over!",20
"After an exceptional stay at the Sheraton Nanshan, this property fell short in welcoming me as a Lifetime Titanium Elite guest. I was upgraded to a regular club room with a sad view. No suite upgrade and they said I had to have breakfast in the club room or use up my welcome amenity to eat in the main breakfast area. Seriously? This property made me feel like an average guest. I haven't been in a regular room in years. It is very disappointing given how many rooms there are here, and that they have a designated check in for elite members. The check in was just underwhelming, no welcome note from management with snacks in my room, and again, the view and room, as basic as can be. So disappointed! Take note from the Sheraton Nanshan and step it up!  ",30
"Stayed at this hotel for one night in early September 2019.  This hotel is an average casino hotel, very large and very busy. Have stayed a few times but as a Marriott Titanium member have been rarely upgraded. Have always been advised the hotel is very busy.  The rooms are quite large but do not have a stocked minibar. Also the room had basic amenities unlike other Sheraton hotels in Asia.  As a Marriott Elite member you are able to request extra amenities on their app. These were not in the room and had to make a request three times for them.  The club lounge is good and has an excellent Happy Hour and Breakfast.  Overall this hotel is average but don’t expect anything special if you are an elite member.    ",30
"Was there a couple of years ago and I gave it a real thumbs up for service and quality. Fast forward to today, tired , poor service and dirty room. Maybe it’s because of the business or joining Marriott  Bonvoy. It was my wife birthday and I wanted to get a room upgrade. Before grouping together it was much easier. Now points are meaner to get by just like Cathay. Had similar experience in Sheraton Melbourne. All I got was a 3 inch cake. The cleaners also never cleaned the cups and gave us so little toiletries. Had to ask all the time. Highly embarrassed. I don’t think I’ll stay in Sheraton chain again. I noticed a big drop in quality after joining Marriot Bonvoy",20
"The Sheraton is a bit of a dinosaur. It hasn't aged gracefully and it shows. Check-in is a real pain with long lines and slow service. The layout of the hotel is truly awful as if you're staying in the Earth tower, the trip to the pool is really far. And the pool is really quite mediocre compared to the competition. The taxi lines are also long and unforgiving. The hotel feels like a casino first and hotel second. There are so many superior choices in Cotai that if I hadn't gone to the Galaxy afterwards, my impression of Macau would have remained rather poor. ",20
"I stayed here for two nights. I don’t think it is worth the price. After I checked out at noon I wanted to use the pool, which I thought was a reasonable request. The unsmiling staff told me that I would have to pay a fee to use the pool only for  a few hours until I took my cab ride to the airport. I paid the price and used the pool but what a disappointment! The burger they served was burned, literally and they charged for it too. ",10
"The worst hotel in Macao, especially the front desk and concierge, is not at all enthusiastic, the shower is broken, and waiting for long time with room change, is far worse than that next to Conrad Macao, Cotai Central",10
"bad 1: checked in loooong quene as in photo. i cant understand why there were only a few staff serving such a long Q. tip: book direct with hotel next time so can use e-check in. bad 2: The Sheraton is comprised of two towers. Earth tower is far from swimming pool.  tip: to avoid the looong walk，choose sky tower if available. esp if you are travelling with kids/old family members.  good 1: comfy bed n clean room. good 2: swimming pool is big. safeguard is responsible since i saw him asking 2 children who play without adults' attendance.  Overall: an average hotel staying experience. Did the job but surprised that there were NO staff expressing greetings, as a hotel residence, during our 2D1N stay.  It's cool if you like this cold feeling.  ",30
"Sheraton Hotel Macau is located at the Cotai Central, inside the Sands Cotai Central - a huge resort complex. Also it known as the largest Sheraton in the world.  Glad to receive some pre-welcome email from the hotel before my stay. One of the email mentioned they have a checkin counter - “Marriott Bonvoy Counter” to enhance an better arrival experience. So that I tried to process my checkin there, however, the first thing I suffer is the staff at the entrance shout to me “Are you our member!?” In an impolite way surely. That’s the way to enhance a better arrival experience for guest? I doubt.  Haven’t meet much challenge after this during checkin, Front office mentioned to me there will be NO any Room Upgrade for all tiers elite Bonvoy member, made me guess it’s a very busy…",30
"Stayed here in June 2019 and the hotel is good, however:  1. Check in and check out is a nightmare- prepare to wait in the queue for around 35-40 minutes. 2. You don't really feel special as a guest because it's so crowded. For me it just misses that personal touch 3. Rooms are quite out dated 4. Room service is pricey and the food isnt good  Now for the good: The location is superb The hotel grounds is lovely   ",30
"Visited this hotel 5 years ago thinking that it is still one of the finest hotel in Cotai with impeccable service at the club lounge .. was I wrong !!!! The lounge has deteriorated into a canteen type environment with disastrous ambience.. people were piling up the food they cannot finish and it was like a disaster relief centre.. real disappointing  Room wise things are looking “tired” and towels definitely need a change ... housekeeping is bad too. Definitely will not return as there are many many choices in this area now with many more hotels up like MGM,Wynn,Parisian,etc just across the road from Sheraton. I suspect the management has changed hands to local management",10
"The first thing I noticed about the Sheraton Macau, and Taipa Island in general, is the shear size and awe of everything. Macau basically took a bunch of US buildings from Vegas, World Trade, Space Needle, and actually created better versions of them.   The appointments in this hotel are what you would expect from a top tier hotel. Everything is immaculate, the staff are friendly and welcoming, and even though Macau is more tailored towards Chinese visitors, I did not feel terribly out of place.  Review disclaimer: I am a US traveler and therefore my tastes may be different than others.  Rooms: The rooms are very well appointed and the bathrooms are gorgeous. The water can be as scalding hot or as ice cold as you want it and the marble and stone work must have been expensive as…",30
"I ve been trying the swimming pool the 18th of july half hour before the expected closing time, i was wearing a swimming slip of versace that was not evidently underwear, and the guys  in charged of the maintainance of the swimming pool just before to get inside the water told me in a rude way that i couldn’t get in because i was wearing underwear i show to him that it wasn’t but it kept insisting rudely, finally i could enter and a second one even more arrogant then the first told me to leave immediately the swimming pool because of i thought i was wearing underwear, i use to stay in 5 stars hotel, i never could expect a bad service and such impolite staff in a marriott hotel, is unacceptable, i lost 15 minutes that i could spent inside the water arguing with them, next time i…",10
"This place is a complete zoo. Attached picture is the line to get into the lounge. Complete mayhem. Avoid the Sheraton Cotai unless you love massive crowds and a maze of a hotel. The staff was friendly and generally wonderful, but management left them to deal with outsized crowds. ",10
"No improvement since hotel opening, the check-in problem is extremely bad, people have to queue up for an hour waiting for check-in.  The hotel fixed the check-in time at 3pm but they are not consider flexible check-in time to avoid crowded in the lobby at the same time.  It's really bad!",20
"1. Hotel isn't clean enough, I saw some stains in the bathroom.  2. This hotel is quite far from Taipa tourist area, it takes 20+ minutes walk.   3. There are two towers, I was staying in the earth tower which is very far from the pool. And the design of the pool is quite strange, there are 13+ tiny pools that I could cardly swim.   4. Mattress is a bit too hard for me and my mum. We both couldn't sleep well. ",20
"The hotel might have good reviews but my first impression with this hotel was total disgust. What 5 star hotel in the modern world has you wait over an hour just to check in?  This was not even as check in first opened, but several hours later.  Sheraton is a second class hotel in the United States and I guess it applies to the Macau location as well.  This review is just based on the check in process. Pathetic.",10
"We recently stayed at the Sheraton Macau from 16th June to 17th June. We had a pleasant stay in one of your very comfortable rooms, however, on the last day we had an issue that we feel wasn't handled as well as we believe it should have been. Please see the following point:  1. We checked out at 13:00 and proceeded to leave our luggage with the bell service.   2. We returned at a little past 18:10 and collected our bag, then caught the transfer bus to the Macau Ferry.   3. On reaching the Macau Ferry at 18: 35  we discovered that we had left a personal item in our room (3144 Earth Tower). We therefore boarded a return transfer bus back to the Sheraton.   4. We arrived back at the Sheraton at approximately 18:50 and went straight to the concierge desk, where we informed someone…",10
First and last time staying in this mega stinky hotel. The corridor at the “non smoking floor” stinks with cigarette stench. Room and bathroom were overused. You feel like a no body in here. Breakfast costs a fortune with no proper service. Never again. ,20
"Stayed here for one night on 31 May - 1 June 2019. Hotel is crowded so there is no upgrade to my room which is acceptable. Service of the lady at the front desk is good. The room is a pretty standard 4 Star hotel room. We checked out around 2 pm on 1 June 2019. Instead of the usual check out point, they asked me to check out using the self checkout on the LCD screen. Did everything correctly but till 5 June have not receive my night credit. This resulted me in missing out ""Double Take: Earn double points"" promo. When i called them on 4 June 2019, they told me they have posted the points already...",20
It's a resort complex but very well organized. Hope you have a gold/platinum status which helps you bypass the check-in/out queue. Rooms are spacious and very clean. Lot's of dining and entertainment options. Got a great treatment at the spa,30
"We re staying for 2 nights at this hotel , and not a single person offer to help us with the luggages.. Then , no room service at all. We went outside until 3 pm and come back , and still, the room is not ciean yet!!!",10
"Let me start with the good things first. I appreciate the friendly service of gym and swimming pool staff; they were very caring, polite and helpful. I also enjoyed the the room view and hotel's facilities in general.   BUT.... The first POINT OF CONTACT IS THE MOST IMPORTANT AND IT TOTALLY RUINED MY EXPERIENCE. First, ridiculous waiting time at the check-in counter (40-50 minutes). This I still can understand... But totally unprofessional service from the staff is unacceptable in the hotel like this. Every time when I check in into hotel, I give the 100USD or 200USD CASH because I do not prefer waiting for the money transfer on the card (since I only have debit cards). But this time, I already paid for the room through booking.com and still were asked to give the deposit. The…",20
"We stayed one night in this hotel. Value wise for a 4/5 star hotel it is pretty reasonable on a weekend.  The check in was quick and they were nice enough to let me do early check in and volunteer to arrange late check out for us.  The room is spacious, with relevant amenities.  As Macau is pretty humid, the room does have a bit of a smell and a bit sticky when u first went in. They should really enhance the room humidity control. The bed is very comfortable.  The hallway needs refreshing as it looks a bit stale.  Please note the hotel lobby in this hotel is always busy. Like a busy airport terminal.  The spa there is wonderful. Do try their elemental herbology range of treatments. It's fantastic. Love my bamboo massage.  What makes our stay special is that their staff Mr leung…",20
"There's 3 types of check-in counter. One for the normal peeps, one for priority lane for kids & elderly. Another one for membership. Seriously what priority lane is this, they take about 30 mins to check in 3-4 guests.",10
"The room really smells when I first enter and the complementary snacks on the table which we had every time are all missing. My son had a horrible reaction to the bedding as this time as his face was all itchy and red. I had stayed there before and had been a member of Marriott, had never experience things like this time. The room is filthy as it smells like old room, and the bedding aren’t clean. The check in time for priority lane takes almost an hour which compare to all other hotels such as Parisian is too long and tedious. There is no staff who asked us how we are as we had been waiting for the check in for a long long time. In Parisian we ordered the champagne suite and the check in is also immediate and they have a little room for us to rest while check in. Sheraton I…",10
"We are regular guests at Sheraton hotels internationally and are so dissapointed by the status of upkeep with the rooms at this hotel.  A horrible smell exists in all carpetted areas, from the lift to the corridor and then the rooms, which can only be described as a mix of old smoke and bodily fluids like vomit and urine. The carpets are stained and the bathroom has grime between the tiles.  The only positive experience is the staff and customer service. Despite their efforts and good will, they cannot change the standard the rooms are in and therefore limited in what they can offer.   Do not come to this hotel with a false pretence of a 5 star standard room.",20
"Same as previous stay, the check-in queue was extremely long this time.  Then I checked with the customer service at the entrance of check-in queue, whether I could use the check-in kiosk even I made my reservation through Expedia, and she said ""Yes"", then reminded me to have cash ready for deposit.  After spending 15 minutes to queue for the kiosk, I couldn't proceed my check-in though the customer service at kiosk scanned my ID card and retrieved my booking 5 times, and she didn't understand why it happened neither.  Then I had to spend another 50 minutes for another queue, damn.  Nevertheless, Vlad was very helpful for my check-in, my request for non-smoking twin room was granted at least. ",30
